debate_media,coverage_media,debate_start_second,coverage_start_second,duration,match_url,transcript
KNTV_20160927_010000_NBC_News_Special_2016_Presidential_Debate_1,WCAU_20160927_110000_Today,5711.7,163.3,3.6,https://archive.org/details/WCAU_20160927_110000_Today#start/163.3/end/166.9,"BUT THIS IS A MAN WHO"
KNTV_20160927_010000_NBC_News_Special_2016_Presidential_Debate_1,WCAU_20160927_110000_Today,5750.5,274.6,8.8,https://archive.org/details/WCAU_20160927_110000_Today#start/274.6/end/283.4,"BECAUSE SHE WAS LATINA. DONALD, SHE HAS A NAME. >> WHERE DID YOU FIND THIS? WHERE DID YOU FIND THIS? >> HER NAME IS MACHADO"
KNTV_20160927_010000_NBC_News_Special_2016_Presidential_Debate_1,WCAU_20160927_110000_Today,5781.2,1977.2,12.3,https://archive.org/details/WCAU_20160927_110000_Today#start/1977.2/end/1989.5,"BUT YOU WANT TO KNOW THE TRUTH? I WAS GOING TO SAY SOMETHING -- >> PLEASE, VERY QUICK. >> -- EXTREMELY ROUGH TO HILLARY, TO HER FAMILY AND I SAID TO MYSELF, I CAN'T DO IT."
KNTV_20160927_010000_NBC_News_Special_2016_Presidential_Debate_1,MSNBCW_20160927_090000_First_Look,827.6,3608.2,7,https://archive.org/details/MSNBCW_20160927_090000_First_Look#start/3608.2/end/3615.2,"BUT THE POLITICIANS HAVEN'T DONE ANYTHING ABOUT IT. NOW, IN ALL FAIRNESS TO SECRETARY CLINTON,"
KNTV_20160927_010000_NBC_News_Special_2016_Presidential_Debate_1,MSNBCW_20160927_090000_First_Look,3540.8,3631.2,11.7,https://archive.org/details/MSNBCW_20160927_090000_First_Look#start/3631.2/end/3642.9,"THEIR POLITICIANS HAVE DONE. >> MR. TRUMP -- >> I THINK DONALD JUST CRITICIZED ME FOR PREPARING FOR THIS DEBATE. AND YES, I DID. AND YOU KNOW WHAT ELSE"
KNTV_20160927_010000_NBC_News_Special_2016_Presidential_Debate_1,MSNBCW_20160927_090000_First_Look,4936.4,3622.8,4,https://archive.org/details/MSNBCW_20160927_090000_First_Look#start/3622.8/end/3626.8,"THEY PUT NAMES -- OH, TEMPERAMENT, LET'S GO AFTER IT."
KNTV_20160927_010000_NBC_News_Special_2016_Presidential_Debate_1,CNNW_20160927_120000_New_Day,829.6,193,4,https://archive.org/details/CNNW_20160927_120000_New_Day#start/193/end/197,"ABOUT IT. NOW, IN ALL FAIRNESS TO SECRETARY CLINTON,"
KNTV_20160927_010000_NBC_News_Special_2016_Presidential_Debate_1,CNNW_20160927_120000_New_Day,955.7,241.4,15.3,https://archive.org/details/CNNW_20160927_120000_New_Day#start/241.4/end/256.7,"PERFECT STORM. IN FACT, DONALD WAS ONE OF THE PEOPLE WHO ROOTED FOR THE HOUSING CRISIS. HE SAID BACK IN 2006, GEE, I HOPE IT DOES COLLAPSE BECAUSE THEN I CAN GO IN AND BUY SOME AND MAKE SOME MONEY. WELL, IT DID COLLAPSE. >> THAT'S CALLED"
KNTV_20160927_010000_NBC_News_Special_2016_Presidential_Debate_1,CNNW_20160927_120000_New_Day,1156.5,227.2,4.3,https://archive.org/details/CNNW_20160927_120000_New_Day#start/227.2/end/231.5,"THEY'RE GONE. AND HILLARY, I JUST ASK YOU THIS, YOU'VE"
KNTV_20160927_010000_NBC_News_Special_2016_Presidential_Debate_1,CNNW_20160927_120000_New_Day,1157.8,606.4,25.8,https://archive.org/details/CNNW_20160927_120000_New_Day#start/606.4/end/632.2,"ASK YOU THIS, YOU'VE BEEN DOING THIS FOR 30 YEARS. WHY ARE YOU JUST THINKING ABOUT THESE SOLUTIONS RIGHT NOW? FOR 30 YEARS YOU'VE BEEN DOING IT AND NOW YOU'RE JUST STARTING TO THINK OF SOLUTIONS. >> WELL, ACTUALLY -- >> I WILL BRING -- EXCUSE ANY. I WILL BRING BACK JOBS. YOU CAN'T BRING BACK JOBS. >> WELL, ACTUALLY, I HAVE THOUGHT ABOUT THIS QUITE A BIT. >> YEAH, FOR 30 YEARS. >> I HAVE -- WELL, NOT QUITE THAT LONG. I THINK MY HUSBAND DID"
KNTV_20160927_010000_NBC_News_Special_2016_Presidential_Debate_1,CNNW_20160927_120000_New_Day,1283.5,210.7,6,https://archive.org/details/CNNW_20160927_120000_New_Day#start/210.7/end/216.7,"DEVASTATION WHERE MANUFACTURERS DOWN"
KNTV_20160927_010000_NBC_News_Special_2016_Presidential_Debate_1,CNNW_20160927_120000_New_Day,2010.8,262.9,5.5,https://archive.org/details/CNNW_20160927_120000_New_Day#start/262.9/end/268.4,"THIS COUNTRY THAT HAS TO BE TAKEN CARE OF. I WILL RELEASE MY TAX RETURNS AGAINST MY"
KNTV_20160927_010000_NBC_News_Special_2016_Presidential_Debate_1,CNNW_20160927_120000_New_Day,2080.5,93.3,2,https://archive.org/details/CNNW_20160927_120000_New_Day#start/93.3/end/95.3,"YOU'RE UNDER AUDIT. SO YOU'VE GOT TO ASK"
KNTV_20160927_010000_NBC_News_Special_2016_Presidential_Debate_1,CNNW_20160927_120000_New_Day,2107.8,271.3,5.6,https://archive.org/details/CNNW_20160927_120000_New_Day#start/271.3/end/276.9,"WALL STREET AND FOREIGN BANKS. OR MAYBE HE DOESN'T WANT THE AMERICAN PEOPLE, ALL OF YOU"
KNTV_20160927_010000_NBC_News_Special_2016_Presidential_Debate_1,CNNW_20160927_120000_New_Day,2128.6,279.3,5.5,https://archive.org/details/CNNW_20160927_120000_New_Day#start/279.3/end/284.8,"PAY ANY FEDERAL INCOME TAX. >> THAT MAKES ME SMART. >> IF HE'S PAID ZERO, THAT MEANS ZERO FOR"
KNTV_20160927_010000_NBC_News_Special_2016_Presidential_Debate_1,CNNW_20160927_120000_New_Day,2197.3,293.2,18.2,https://archive.org/details/CNNW_20160927_120000_New_Day#start/293.2/end/311.4,"YOU WANT TO RESPOND TO THAT? >> I DO. YOU KNOW, I MADE A MISTAKE USING A PRIVATE E-MAIL. >> THAT'S FOR SURE. >> AND IF I HAD TO DO IT OVER AGAIN, I WOULD OBVIOUSLY DO IT DIFFERENTLY, BUT I'M NOT GOING TO MAKE ANY EXCUSES. IT WAS A MISTAKE AND I TAKE RESPONSIBILITY FOR THAT."
KNTV_20160927_010000_NBC_News_Special_2016_Presidential_Debate_1,CNNW_20160927_120000_New_Day,3540.8,423.4,11.4,https://archive.org/details/CNNW_20160927_120000_New_Day#start/423.4/end/434.8,"THEIR POLITICIANS HAVE DONE. >> MR. TRUMP -- >> I THINK DONALD JUST CRITICIZED ME FOR PREPARING FOR THIS DEBATE. AND YES, I DID. AND YOU KNOW WHAT ELSE"
KNTV_20160927_010000_NBC_News_Special_2016_Presidential_Debate_1,CNNW_20160927_120000_New_Day,3728.1,322.7,6.7,https://archive.org/details/CNNW_20160927_120000_New_Day#start/322.7/end/329.4,"COME TO THAT CONCLUSION AND I THINK I DID A GREAT JOB AND A GREAT SERVICE NOT ONLY FOR THE COUNTRY,"
KNTV_20160927_010000_NBC_News_Special_2016_Presidential_Debate_1,CNNW_20160927_120000_New_Day,3751.3,336.6,5.7,https://archive.org/details/CNNW_20160927_120000_New_Day#start/336.6/end/342.3,"GOING TO BE ASKING US QUESTIONS, SO HE TRIED TO PUT THE WHOLE RACIST BIRTHER LIE TO BED."
KNTV_20160927_010000_NBC_News_Special_2016_Presidential_Debate_1,CNNW_20160927_120000_New_Day,3814.9,344,10.6,https://archive.org/details/CNNW_20160927_120000_New_Day#start/344/end/354.6,"TWICE BY THE JUSTICE DEPARTMENT. SO HE HAS A LONG RECORD OF ENGAGING IN RACIST BEHAVIOR."
KNTV_20160927_010000_NBC_News_Special_2016_Presidential_Debate_1,CNNW_20160927_120000_New_Day,4794.1,366.2,5.4,https://archive.org/details/CNNW_20160927_120000_New_Day#start/366.2/end/371.6,"INVASION. WHAT MAKES YOUR -- >> I DID NOT SUPPORT THE WAR IN IRAQ."
KNTV_20160927_010000_NBC_News_Special_2016_Presidential_Debate_1,CNNW_20160927_120000_New_Day,4917.4,308.3,3.8,https://archive.org/details/CNNW_20160927_120000_New_Day#start/308.3/end/312.1,">> WHY IS YOUR JUDGMENT ANY DIFFERENT THAN MRS. CLINTON'S? >> I HAVE MUCH BETTER"
KNTV_20160927_010000_NBC_News_Special_2016_Presidential_Debate_1,CNNW_20160927_120000_New_Day,4950.2,1742.8,5.6,https://archive.org/details/CNNW_20160927_120000_New_Day#start/1742.8/end/1748.4,"SCREEN, I DON'T KNOW WHO YOU WERE TALKING TO, SECRETARY CLINTON,"
KNTV_20160927_010000_NBC_News_Special_2016_Presidential_Debate_1,CNNW_20160927_120000_New_Day,5597,17.6,60.6,https://archive.org/details/CNNW_20160927_120000_New_Day#start/17.6/end/78.2,"RIGHT NOW. WHAT DID YOU MEAN BY THAT? >> SHE DOESN'T HAVE THE LOOK. SHE DOESN'T HAVE THE STAMINA. I SAID SHE DOESN'T HAVE THE STAMINA. AND I DON'T BELIEVE SHE DOES HAVE THE STAMINA. TO BE PRESIDENT OF THIS COUNTRY, YOU NEED TREMENDOUS STAMINA. >> THE QUOTE WAS ""I JUST DON'T THINK SHE HAS -- >> WAIT A MINUTE. YOU ASKED ME A QUESTION. DID SHE ASK ME A QUESTION? YOU HAVE TO BE ABLE TO NEGOTIATE ON TRADE DEALS. YOU HAVE TO BE ABLE TO NEGOTIATE -- THAT'S RIGHT, WITH JAPAN, WITH SAUDI ARABIA. I MEAN, CAN YOU IMAGINE WE'RE DEFENDING SAUDI ARABIA AND WITH ALL OF THE MONEY THEY HAVE, WE'RE DEFENDING THEM AND THEY'RE NOT PAYING? ALL YOU HAVE TO DO IS SPEAK TO THEM. WAIT, YOU HAVE SO MANY DIFFERENT THINGS YOU HAVE TO BE ABLE TO DO AND I DON'T BELIEVE THAT HILLARY HAS THE STAMINA. >> LET'S LET HER RESPOND. >> WELL, AS SOON AS HE TRAVELS TO 112 COUNTRIES AND NEGOTIATES A PEACE DEAL, A CEASE-FIRE, A RELEASE OF DISSIDENTS, AN OPENING OF NEW"
KNTV_20160927_010000_NBC_News_Special_2016_Presidential_Debate_1,CNNW_20160927_120000_New_Day,5597.6,383.8,9.3,https://archive.org/details/CNNW_20160927_120000_New_Day#start/383.8/end/393.1,"THAT? >> SHE DOESN'T HAVE THE LOOK. SHE DOESN'T HAVE THE STAMINA. I SAID SHE DOESN'T HAVE THE STAMINA. AND I DON'T BELIEVE SHE DOES HAVE THE"
KNTV_20160927_010000_NBC_News_Special_2016_Presidential_Debate_1,CNNW_20160927_120000_New_Day,5642.4,394.9,16,https://archive.org/details/CNNW_20160927_120000_New_Day#start/394.9/end/410.9,"RESPOND. >> WELL, AS SOON AS HE TRAVELS TO 112 COUNTRIES AND NEGOTIATES A PEACE DEAL, A CEASE-FIRE, A RELEASE OF DISSIDENTS, AN OPENING OF NEW OPPORTUNITIES IN"
KNTV_20160927_010000_NBC_News_Special_2016_Presidential_Debate_1,WPVI_20160927_010000_ABC_News_Your_Voice_Your_Vote_16_-_The_Presidential_Debates,1184.5,7196.1,12.2,https://archive.org/details/WPVI_20160927_010000_ABC_News_Your_Voice_Your_Vote_16_-_The_Presidential_Debates#start/7196.1/end/7208.3,"A PRETTY GOOD JOB IN THE 1990s. I THINK A LOT ABOUT WHAT WORKED AND HOW -- >> HE APPROVED NAST  ED NAFTA, SINGLE WORST TRADE DEAL APPROVED IN THE"
KNTV_20160927_010000_NBC_News_Special_2016_Presidential_Debate_1,KYW_20160927_033500_The_Late_Show_With_Stephen_Colbert,1044.1,331.8,6.4,https://archive.org/details/KYW_20160927_033500_The_Late_Show_With_Stephen_Colbert#start/331.8/end/338.2,"CENTURY. DONALD THINKS THAT CLIMATE CHANGE IS A HOAXE PERPETRATED BY"
KNTV_20160927_010000_NBC_News_Special_2016_Presidential_Debate_1,KYW_20160927_033500_The_Late_Show_With_Stephen_Colbert,1536.1,472,9.3,https://archive.org/details/KYW_20160927_033500_The_Late_Show_With_Stephen_Colbert#start/472/end/481.3,"TRILLION. >> MR. TRUMP -- >> AND LOOK AT HER WEBSITE. YOU KNOW WHAT, IT'S NO DIFFERENT THAN THIS. SHE'S TELLING US HOW TO FIGHT ISIS. GO TO HER WEBSITE."
KNTV_20160927_010000_NBC_News_Special_2016_Presidential_Debate_1,KYW_20160927_033500_The_Late_Show_With_Stephen_Colbert,2049.7,439.7,2.1,https://archive.org/details/KYW_20160927_033500_The_Late_Show_With_Stephen_Colbert#start/439.7/end/441.8,"NEGOTIABLE, NO, LET HER RELEASE -- WHY DID"
KNTV_20160927_010000_NBC_News_Special_2016_Presidential_Debate_1,KYW_20160927_033500_The_Late_Show_With_Stephen_Colbert,4212.4,605.4,2.3,https://archive.org/details/KYW_20160927_033500_The_Late_Show_With_Stephen_Colbert#start/605.4/end/607.7,"IT COULD BE RUSSIA. COULD ALSO BE CHINA."
KNTV_20160927_010000_NBC_News_Special_2016_Presidential_Debate_1,KYW_20160927_033500_The_Late_Show_With_Stephen_Colbert,5711.9,669.2,11.5,https://archive.org/details/KYW_20160927_033500_The_Late_Show_With_Stephen_Colbert#start/669.2/end/680.7,"BUT THIS IS A MAN WHO HAS CALLED WOMEN PIGS, SLOBS, AND DOGS AND SOMEONE WHO HAS SAID"
KNTV_20160927_010000_NBC_News_Special_2016_Presidential_Debate_1,FOXNEWSW_20160927_100000_FOX__Friends,1539.1,3628.6,14.1,https://archive.org/details/FOXNEWSW_20160927_100000_FOX__Friends#start/3628.6/end/3642.7,"WEBSITE. YOU KNOW WHAT, IT'S NO DIFFERENT THAN THIS. SHE'S TELLING US HOW TO FIGHT ISIS. GO TO HER WEBSITE. SHE TELLS YOU HOW TO FIGHT ISIS ON HER WEBSITE. I DON'T THINK GENERAL DOUGLAS MacARTHUR WOULD LIKE THAT TOO MUCH."
KNTV_20160927_010000_NBC_News_Special_2016_Presidential_Debate_1,FOXNEWSW_20160927_100000_FOX__Friends,1696.8,3643.9,3.4,https://archive.org/details/FOXNEWSW_20160927_100000_FOX__Friends#start/3643.9/end/3647.3,"WEALTHIEST AMERICANS, SECRETARY CLINTON. >> I HAVE A FEELING BY THE END OF THIS"
KNTV_20160927_010000_NBC_News_Special_2016_Presidential_Debate_1,FOXNEWSW_20160927_100000_FOX__Friends,1703.6,7253.5,2.8,https://archive.org/details/FOXNEWSW_20160927_100000_FOX__Friends#start/7253.5/end/7256.3,">> WHY NOT, YEAH. WHY NOT."
KNTV_20160927_010000_NBC_News_Special_2016_Presidential_Debate_1,FOXNEWSW_20160927_100000_FOX__Friends,1824.7,6440,29.9,https://archive.org/details/FOXNEWSW_20160927_100000_FOX__Friends#start/6440/end/6469.9,">> TYPICAL POLITICIAN. ALL TALK, NO ACTION. SOUNDS GOOD, DOESN'T WORK. NEVER GOING TO HAPPEN. OUR COUNTRY IS SUFFERING BECAUSE PEOPLE LIKE SECRETARY CLINTON HAVE MADE SUCH BAD DECISIONS IN TERMS OF OUR JOBS, AND IN TERMS OF WHAT'S GOING ON. NOW, LOOK, WE HAVE THE WORST REVIVAL OF AN ECONOMY SINCE THE GREAT DEPRESSION, AND BELIEVE ME, WE'RE IN A BUBBLE RIGHT NOW AND THE ONLY THING THAT LOOKS GOOD IS THE STOCK MARKET, BUT IF YOU RAISE INTEREST"
KNTV_20160927_010000_NBC_News_Special_2016_Presidential_Debate_1,FOXNEWSW_20160927_100000_FOX__Friends,2010.8,6563.4,10.3,https://archive.org/details/FOXNEWSW_20160927_100000_FOX__Friends#start/6563.4/end/6573.7,"THIS COUNTRY THAT HAS TO BE TAKEN CARE OF. I WILL RELEASE MY TAX RETURNS AGAINST MY LAWYER'S WISHES. WHEN SHE RELEASES HER HAVE BEEN DELETED."
KNTV_20160927_010000_NBC_News_Special_2016_Presidential_Debate_1,FOXNEWSW_20160927_100000_FOX__Friends,2361,7222.5,9.3,https://archive.org/details/FOXNEWSW_20160927_100000_FOX__Friends#start/7222.5/end/7231.8,"WE'RE A DEBTOR NATION. WE'RE A SERIOUS DEBTOR NATION. AND WE HAVE A COUNTRY THAT NEEDS NEW ROADS, NEW TUNNELS, NEW BRIDGES, NEW AIRPORTS, NEW SCHOOLS, NEW HOSPITALS. AND WE DON'T HAVE THE"
KNTV_20160927_010000_NBC_News_Special_2016_Presidential_Debate_1,FOXNEWSW_20160927_100000_FOX__Friends,3235.6,6319.7,14.8,https://archive.org/details/FOXNEWSW_20160927_100000_FOX__Friends#start/6319.7/end/6334.5,"EVERYTHING POSSIBLE TO IMPROVE POLICING TO GO RIGHT AT IMPLICIT BIAS. DO YOU BELIEVE THAT POLICE ARE IMPLICITLY BIASED AGAINST BLACK PEOPLE? >> LESTER, I THINK IMPLICIT BIAS IS A PROBLEM FOR EVERYONE, NOT JUST POLICE. I THINK, UNFORTUNATELY, TOO"
KNTV_20160927_010000_NBC_News_Special_2016_Presidential_Debate_1,FOXNEWSW_20160927_100000_FOX__Friends,3815,3648.6,5.5,https://archive.org/details/FOXNEWSW_20160927_100000_FOX__Friends#start/3648.6/end/3654.1,"TWICE BY THE JUSTICE DEPARTMENT. SO HE HAS A LONG"
KNTV_20160927_010000_NBC_News_Special_2016_Presidential_Debate_1,FOXNEWSW_20160927_100000_FOX__Friends,4180.5,9684,10.1,https://archive.org/details/FOXNEWSW_20160927_100000_FOX__Friends#start/9684/end/9694.1,"SO WHEN SECRETARY CLINTON TALKS ABOUT THIS, I MEAN, I'LL TAKE THE ADMIRALS AND I'LL TAKE THE GENERALS ANY DAY OVER THE POLITICAL HACKS THAT I SEE THAT HAVE LED OUR COUNTRY SO BRILLIANTLY"
KNTV_20160927_010000_NBC_News_Special_2016_Presidential_Debate_1,FOXNEWSW_20160927_100000_FOX__Friends,4487.6,3674.3,3,https://archive.org/details/FOXNEWSW_20160927_100000_FOX__Friends#start/3674.3/end/3677.3,"HARD. DONALD SUPPORTED THE"
KNTV_20160927_010000_NBC_News_Special_2016_Presidential_Debate_1,FOXNEWSW_20160927_100000_FOX__Friends,4948.5,5164.2,9,https://archive.org/details/FOXNEWSW_20160927_100000_FOX__Friends#start/5164.2/end/5173.2,"THE AFL-CIO THE OTHER DAY BEHIND THE BLUE SCREEN, I DON'T KNOW WHO YOU WERE TALKING TO, SECRETARY CLINTON, BUT YOU WERE TOTALLY OUT OF CONTROL."
KNTV_20160927_010000_NBC_News_Special_2016_Presidential_Debate_1,FOXNEWSW_20160927_100000_FOX__Friends,5595.5,5315.7,2.3,https://archive.org/details/FOXNEWSW_20160927_100000_FOX__Friends#start/5315.7/end/5318,"SHE'S STANDING HERE RIGHT NOW. WHAT DID YOU MEAN BY"
KNTV_20160927_010000_NBC_News_Special_2016_Presidential_Debate_1,FOXNEWSW_20160927_100000_FOX__Friends,5644.8,5329.5,26.099999999999,https://archive.org/details/FOXNEWSW_20160927_100000_FOX__Friends#start/5329.5/end/5355.6,"RESPOND. >> WELL, AS SOON AS HE TRAVELS TO 112 COUNTRIES AND NEGOTIATES A PEACE DEAL, A CEASE-FIRE, A RELEASE OF DISSIDENTS, AN OPENING OF NEW OPPORTUNITIES IN NATIONS AROUND THE WORLD, OR EVEN SPENDS FRONT OF A CONGRESSIONAL COMMITTEE, HE CAN TALK TO ME ABOUT STAMINA. >> THE WORLD -- LET ME TELL YOU. LET ME TELL YOU."
KNTV_20160927_010000_NBC_News_Special_2016_Presidential_Debate_1,FOXNEWSW_20160927_100000_FOX__Friends,5780,9292.2,20.6,https://archive.org/details/FOXNEWSW_20160927_100000_FOX__Friends#start/9292.2/end/9312.8,"WOULD AGREE THAT SHE DESERVES IT AND NOBODY FEELS SORRY FOR HER. BUT YOU WANT TO KNOW THE TRUTH? I WAS GOING TO SAY SOMETHING -- >> PLEASE, VERY QUICK. >> -- EXTREMELY ROUGH TO HILLARY, TO HER FAMILY AND I SAID TO MYSELF, I CAN'T DO IT. I JUST CAN'T DO IT. IT'S INAPPROPRIATE. IT'S NOT NICE. BUT SHE SPENT HUNDREDS OF MILLIONS OF DOLLARS"
KNTV_20160927_010000_NBC_News_Special_2016_Presidential_Debate_1,FOXNEWSW_20160927_040000_Hannity,1156.7,847.4,14,https://archive.org/details/FOXNEWSW_20160927_040000_Hannity#start/847.4/end/861.4,"THEY'RE GONE. AND HILLARY, I JUST ASK YOU THIS, YOU'VE BEEN DOING THIS FOR 30 YEARS. WHY ARE YOU JUST THINKING ABOUT THESE SOLUTIONS RIGHT NOW? FOR 30 YEARS YOU'VE BEEN DOING IT AND NOW YOU'RE JUST STARTING TO THINK OF SOLUTIONS. >> WELL, ACTUALLY --"
KNTV_20160927_010000_NBC_News_Special_2016_Presidential_Debate_1,FOXNEWSW_20160927_040000_Hannity,2012.7,1089.2,34.8,https://archive.org/details/FOXNEWSW_20160927_040000_Hannity#start/1089.2/end/1124,"I WILL RELEASE MY TAX RETURNS AGAINST MY LAWYER'S WISHES. WHEN SHE RELEASES HER HAVE BEEN DELETED. AS SOON AS SHE RELEASES THEM, I WILL RELEASE -- I WILL RELEASE MY TAX RETURNS AND THAT'S AGAINST, MY LAWYERS THEY SAY DON'T DO IT. I WILL TELL YOU THIS. IN FACT, WATCHING SHOWS, READING THE PAPERS, ALMOST EVERY LAWYER SAYS YOU DON'T RELEASE YOUR RETURNS UNTIL THE AUDIT'S COMPLETE. WHEN THE AUDIT'S COMPLETE, I'LL DO IT BUT I WOULD GO AGAINST THEM IF SHE RELEASES HER E-MAILS >> SO IT'S NEGOTIABLE?"
KNTV_20160927_010000_NBC_News_Special_2016_Presidential_Debate_1,FOXNEWSW_20160927_040000_Hannity,2796,1655.8,16.2,https://archive.org/details/FOXNEWSW_20160927_040000_Hannity#start/1655.8/end/1672,"THAT'S LAW AND ORDER. WE NEED LAW AND ORDER. IF WE DON'T HAVE IT, WE'RE NOT GOING TO HAVE A COUNTRY, AND WHEN I LOOK AT WHAT'S GOING ON IN CHARLOTTE, A CITY I LOVE, A CITY WHERE I HAVE INVESTMENTS, WHEN I LOOK AT WHAT'S GOING ON THROUGHOUT VARIOUS PARTS OF OUR COUNTRY, WHETHER IT'S -- I MEAN, I CAN JUST KEEP"
KNTV_20160927_010000_NBC_News_Special_2016_Presidential_Debate_1,FOXNEWSW_20160927_040000_Hannity,2830.9,1674.2,9.8,https://archive.org/details/FOXNEWSW_20160927_040000_Hannity#start/1674.2/end/1684,"VERY -- I MEAN, A LARGE PERCENTAGE OF THEM IN THE UNITED STATES. WE HAVE A SITUATION WHERE WE HAVE OUR INNER CITIES, AFRICAN-AMERICANS,"
KNTV_20160927_010000_NBC_News_Special_2016_Presidential_Debate_1,FOXNEWSW_20160927_040000_Hannity,5673.1,2442.3,26.7,https://archive.org/details/FOXNEWSW_20160927_040000_Hannity#start/2442.3/end/2469,"BUT IT'S BAD EXPERIENCE. WE HAVE MADE SO MANY BAD DEALS DURING THE LAST -- SO SHE'S GOT EXPERIENCE THAT I AGREE, BUT IT'S BAD, BAD EXPERIENCE. WHETHER IT'S THE IRAN DEAL THAT YOU'RE SO IN LOVE WITH WHERE WE GAVE THEM $150 BILLION BACK. WHETHER IT'S THE IRAN DEAL, WHETHER IT'S ANYTHING YOU -- YOU ALMOST CAN'T NAME A GOOD DEAL. I AGREE, SHE'S GOT EXPERIENCE, BUT IT'S BAD EXPERIENCE."
KNTV_20160927_010000_NBC_News_Special_2016_Presidential_Debate_1,WPVI_20160927_030000_Action_News_11pm,1189.2,0.8,5.5,https://archive.org/details/WPVI_20160927_030000_Action_News_11pm#start/0.8/end/6.3,"WHAT WORKED AND HOW -- >> HE APPROVED NAST  ED NAFTA,"
KNTV_20160927_010000_NBC_News_Special_2016_Presidential_Debate_1,WPVI_20160927_030000_Action_News_11pm,1316.7,1892.1,8.5,https://archive.org/details/WPVI_20160927_030000_Action_News_11pm#start/1892.1/end/1900.6,"NEGOTIATED. THE TERMS WERE LAID OUT. I WROTE -- >> YOU CALLED IT THE GOLD STANDARD. YOU KACALLED IT THE GOLD"
KNTV_20160927_010000_NBC_News_Special_2016_Presidential_Debate_1,WPVI_20160927_030000_Action_News_11pm,1695.8,167.9,10.5,https://archive.org/details/WPVI_20160927_030000_Action_News_11pm#start/167.9/end/178.4,"WEALTHIEST AMERICANS, SECRETARY CLINTON. >> I HAVE A FEELING BY THE END OF THIS EVENING I'M GOING TO BE BLAMED FOR EVERYTHING THAT'S EVER HAPPENED. >> WHY NOT. >> WHY NOT, YEAH. WHY NOT."
KNTV_20160927_010000_NBC_News_Special_2016_Presidential_Debate_1,WPVI_20160927_030000_Action_News_11pm,1821.1,81.1,4.7,https://archive.org/details/WPVI_20160927_030000_Action_News_11pm#start/81.1/end/85.8,"TOP. >> MR. TRUMP -- >> TYPICAL POLITICIAN."
KNTV_20160927_010000_NBC_News_Special_2016_Presidential_Debate_1,WPVI_20160927_030000_Action_News_11pm,2019.4,123.2,2,https://archive.org/details/WPVI_20160927_030000_Action_News_11pm#start/123.2/end/125.2,"HAVE BEEN DELETED."
KNTV_20160927_010000_NBC_News_Special_2016_Presidential_Debate_1,WPVI_20160927_030000_Action_News_11pm,2836,137.8,3.1,https://archive.org/details/WPVI_20160927_030000_Action_News_11pm#start/137.8/end/140.9,"WHERE WE HAVE OUR INNER CITIES,"
KNTV_20160927_010000_NBC_News_Special_2016_Presidential_Debate_1,WPVI_20160927_030000_Action_News_11pm,3089.4,147.5,8.7,https://archive.org/details/WPVI_20160927_030000_Action_News_11pm#start/147.5/end/156.2,"THAT ARE INEFFECTIVE. STOP AND FRISK WAS FOUND TO BE UNCONSTITUTIONAL AND IN PART BECAUSE IT WAS INEFFECTIVE."
KNTV_20160927_010000_NBC_News_Special_2016_Presidential_Debate_1,WPVI_20160927_030000_Action_News_11pm,3760.7,74.5,5.8,https://archive.org/details/WPVI_20160927_030000_Action_News_11pm#start/74.5/end/80.3,"IT CAN'T BE DISMISSED THAT EASILY. HE HAS REALLY STARTED"
KNTV_20160927_010000_NBC_News_Special_2016_Presidential_Debate_1,WPVI_20160927_030000_Action_News_11pm,4487.7,1883.3,7.4,https://archive.org/details/WPVI_20160927_030000_Action_News_11pm#start/1883.3/end/1890.7,"HARD. DONALD SUPPORTED THE INVASION OF IRAQ. >> WRONG. >> THAT IS ABSOLUTELY -- >> WRONG. >> -- PROVED OVER AND"
KNTV_20160927_010000_NBC_News_Special_2016_Presidential_Debate_1,WPVI_20160927_100000_Action_News_at_600_AM,1559.9,3637.3,2.8,https://archive.org/details/WPVI_20160927_100000_Action_News_at_600_AM#start/3637.3/end/3640.1,">> SEE, YOU TELLING THE ENEMY EVERYTHING YOU WANT TO DO. NO WONDER YOU'VE,"
KNTV_20160927_010000_NBC_News_Special_2016_Presidential_Debate_1,WPVI_20160927_100000_Action_News_at_600_AM,1694.6,3651.8,4.1,https://archive.org/details/WPVI_20160927_100000_Action_News_at_600_AM#start/3651.8/end/3655.9,"INCREASES ON THE WEALTHIEST AMERICANS, SECRETARY CLINTON."
KNTV_20160927_010000_NBC_News_Special_2016_Presidential_Debate_1,WPVI_20160927_100000_Action_News_at_600_AM,2124.1,3627.7,4.2,https://archive.org/details/WPVI_20160927_100000_Action_News_at_600_AM#start/3627.7/end/3631.9,"AUTHORITIES WHEN HE WAS TRYING TO GET A CASINO LICENSE AND THEY SHOWED HE DIDN'T"
KNTV_20160927_010000_NBC_News_Special_2016_Presidential_Debate_1,WPVI_20160927_100000_Action_News_at_600_AM,4486.9,3641.9,4.4,https://archive.org/details/WPVI_20160927_100000_Action_News_at_600_AM#start/3641.9/end/3646.3,"AND REALLY WORKING HARD. DONALD SUPPORTED THE INVASION OF IRAQ."
KNTV_20160927_010000_NBC_News_Special_2016_Presidential_Debate_1,MSNBCW_20160927_040000_Live_Post_Debate,1684,91.6,13.1,https://archive.org/details/MSNBCW_20160927_040000_Live_Post_Debate#start/91.6/end/104.7,"INNER CITIES AND LOTS OF OTHER THINGS AND IT WOULD BE BEAUTIFUL BUT WE HAVE NO LEADERSHIP AND HONESTLY, THAT STARTS WITH SECRETARY CLINTON. >> ALL RIGHT. YOU HAVE IS TWO MINUTES OF THE SAME QUESTION TO DEFEND TAX INCREASES ON THE WEALTHIEST AMERICANS,"
KNTV_20160927_010000_NBC_News_Special_2016_Presidential_Debate_1,WUVP_20160927_110000_Despierta_America,1706.4,279.5,7.2,https://archive.org/details/WUVP_20160927_110000_Despierta_America#start/279.5/end/286.7,"YOU KNOW, JUST JOIN THE DEBATE BY SAYING MORE CRAZY THINGS. NOW -- >> HEY, THERE'S NOTHING CRAZY ABOUT"
KNTV_20160927_010000_NBC_News_Special_2016_Presidential_Debate_1,WUVP_20160927_110000_Despierta_America,2010.8,4134.7,5.9,https://archive.org/details/WUVP_20160927_110000_Despierta_America#start/4134.7/end/4140.6,"THIS COUNTRY THAT HAS TO BE TAKEN CARE OF. I WILL RELEASE MY TAX RETURNS AGAINST MY"
KNTV_20160927_010000_NBC_News_Special_2016_Presidential_Debate_1,WUVP_20160927_110000_Despierta_America,3790.2,311.4,21.2,https://archive.org/details/WUVP_20160927_110000_Despierta_America#start/311.4/end/332.6,"IT. BUT REMEMBER, DONALD STARTED HIS CAREER BACK IN 1973 BEING SUED BY THE JUSTICE DEPARTMENT FOR RACIAL DISCRIMINATION BECAUSE HE WOULD NOT RENT APARTMENTS IN ONE OF HIS DEVELOPMENTS TO AFRICAN-AMERICANS AND HE MADE SURE THAT THE PEOPLE WHO WORKED FOR"
KNTV_20160927_010000_NBC_News_Special_2016_Presidential_Debate_1,WUVP_20160927_110000_Despierta_America,5729.8,765.7,16,https://archive.org/details/WUVP_20160927_110000_Despierta_America#start/765.7/end/781.7,"DESERVE EQUAL PAY UNLESS THEY DO AS GOOD A JOB AS MEN. >> DIDN'T SAY. >> AND ONE OF THE WORST THINGS HE SAID WAS ABOUT A WOMAN IN A BEAUTY CONTEST. HE LOVES BEAUTY CONTESTS, SUPPORTING THEM AND HANGING AROUND THEM. AND HE CALLED THIS"
KNTV_20160927_010000_NBC_News_Special_2016_Presidential_Debate_1,MSNBCW_20160927_030000_Live_Post_Debate,1767,3231.1,7.8,https://archive.org/details/MSNBCW_20160927_030000_Live_Post_Debate#start/3231.1/end/3238.9,"FAMILY. AND WHEN YOU LOOK AT -- >> HOW MUCH, HOW MUCH? LESTER, HOW MUCH? >> IT S AS I SAID, TRUMPED UP TRICKLE DOWN. TRICKLE DOWN DID NOT"
KNTV_20160927_010000_NBC_News_Special_2016_Presidential_Debate_1,MSNBCW_20160927_030000_Live_Post_Debate,3376.2,2046.9,38.1,https://archive.org/details/MSNBCW_20160927_030000_Live_Post_Debate#start/2046.9/end/2085,"CITY, STOP AND FRISK, WE HAD 2,200 MURDERS AND STOP AND FRISK BROUGHT IT DOWN TO 500 MURDERS. OF MURDERS. HARD TO BELIEVE. TO BE GOOD? BUT WE WENT FROM 2,200 TO 500 AND IT WAS CONTINUED ON BY MAYOR BLOOMBERG AND IT WAS TERMINATED BY CURRENT MAYOR. BUT STOP AND FRISK HAD A TREMENDOUS IMPACT ON THE SAFETY OF NEW YORK CITY, TREMENDOUS BEYOND BELIEF. SO WHEN YOU SAY IT HAS NO IMPACT, IT REALLY DID. IT HAD A VERY, VERY BIG IMPACT. >> WELL, IT'S ALSO FAIR TO SAY, IF WE'RE GOING TO TALK ABOUT MAYORS, THAT UNDER THE CURRENT MAYOR, CRIME"
