start_second,duration,coverage_count,programs,match_url,transcript
224,172,1,FBC_20161020_040000_3rd_Presidential_Debate,https://archive.org/details/KQED_20161020_010000_PBS_NewsHour_Debates_2016_A_Special_Report#start/224/end/396,"THAT IS I THINK -- >> GOOD EVENING FROM THE UNIVERSITY OF NEVADA LAS VEGAS. I'M CHRIS WALLACE OF FOX NEWS. I WELCOME YOU TO THE THIRD AND FINAL OF THE 2016 PRESIDENTIAL DEBATES BETWEEN IS SECRETARY OF J. TRUMP. THIS DEBATE SPONSORED BY THE COMMISSION ON PRESIDENTIAL DEBATES, THE COMMISSION HAS DESIGNED THE FORMAT. SIX ROUGHLY 15-MINUTE SEGMENTS WITH TWO-MINUTE ANSWERS THEN OPEN DISCUSSION FOR THE REST OF EACH SEGMENT. BOTH CAMPAIGNS HAVE AGREED TO THOSE RULES. FOR THE RECORD, I DECIDED THE TOPICS AND THE QUESTIONS IN EACH TOPIC, NONE OF THOSE QUESTIONS HAS BEEN SHARED WITH THE COMMISSION OR THE TWO CANDIDATES. THE AUDIENCE HERE IN THE HALL HAS PROMISED TO REMAIN SILENCE NO CHOOSE, BOOS OR OTHER INTERRUPTIONS SO WE AND YOU CAN FOCUS ON WHAT THE CANDIDATES HAVE TO SAY. NO NOISE, EXCEPT RIGHT NOW AS WE WELCOME THE DEMOCRATIC NOMINEE FOR PRESIDENT SECRETARY CLINTON AND THE REPUBLICAN NOMINEE FOR PRESIDENT MR. TRUMP. [ Applause ] SECRETARY CLINTON, MR. TRUMP. WELCOME. LET'S GET RIGHT TO IT. THE FIRST TOP SICK THE SUPREME COURT. YOU BOTH TALKED BRIEFLY ABOUT THE COURT IN THE LAST DEBATE BUT I WANT TO DRILL DOWN ON THIS BECAUSE THE NEXT PRESIDENT WILL ALMOST CERTAINLY HAVE AT LEAST ONE APPOINTMENT AND LIKELY OR POSSIBLY TWO OR THREE APPOINTMENTS WHICH MEANS THAT YOU WILL IN EFFECT DETERMINE THE BALANCE OF THE COURT FOR WHAT COULD BE THE NEXT QUARTER CENTURY. FIRST OF ALL, WHERE YOU WANT TO SEE THE COURT TAKE THE COUNTRY AND SECONDLY, WHAT'S YOUR VIEW ON HOW THE CONSTITUTION SHOULD BE INTERPRETED. IS IT JUST WORDS OR IS IT A LIVING DOCUMENT TO BE APPLIED FLEXIBLY ACCORDING TO CHANGING CIRCUMSTANCES, IN THIS SEGMENT, SECRETARY CLINTON YOU GO FIRST, YOU HAVE TWO MINUTES. >> THANK YOU VERY MUCH, CHRIS, THANKS TO UNLV FOR HOSTING US. YOU KNOW, I THINK REALLY RACES THE CENTRAL ISSUE IN THIS ELECTION, WHAT KIND OF COUNTRY ARE WE GOING TO BE. WHAT KIND OF OPPORTUNITIES WILL WE PROVIDE FOR OUR CITIZENS, WHAT KIND OF RIGHTS WILL AMERICANS HAVE. AND I FEEL STRONGLY THAT THE SUPREME COURT NEEDS TO STAND ON THE SIDE OF THE AMERICAN PEOPLE, NOT ON THE SIDE OF THE POWERFUL CORPORATIONS AND THE WEALTHY. FOR ME, THAT MEANS THAT WE NEED A SUPREME COURT THAT WILL STAND UP ON BEHALF OF WOMEN'S RIGHTS, ON BEHALF OF THE RIGHTS OF THE"
534,117,1,FBC_20161020_040000_3rd_Presidential_Debate,https://archive.org/details/KQED_20161020_010000_PBS_NewsHour_Debates_2016_A_Special_Report#start/534/end/651,"AMENDMENT WHICH IS UNDER ABSOLUTE SIEGE. I BELIEVE AS MY OPPONENT SHOULD WIN THIS RACE, WHICH DON'T THINK WILL HAPPEN, WE WILL HAVE A 2nd AMENDMENT WHICH WILL BE VERY, VERY SMALL REPLICA OF WHAT IT IS RIGHT NOW. BUT I FEEL THAT IT'S ABSOLUTELY IMPORTANT THAT WE UPHOLD BECAUSE OF THE FACT THAT IT IS UNDER SUCH TRAUMA, I FEEL THAT THE JUSTICES THAT I AM GOING TO APPOINT, THAT I NAMED 20 OF THEM, THE JUSTICES THAT I'M GOING TO APPOINT WILL BE PRO RIGHTS, THEY WILL HAVE CONSERVATIVE BENT, THEY WILL BE PROTECTING THE 2nd AMENDMENT, THEY ARE GREAT SCHOLARS IN ALL CASES AND THEY ARE PEOPLE OF TREMENDOUS RESPECT. THEY WILL INTERPRET THE CONSTITUTION THE WAY THE FOUNDERS WANTED IT INTERPRETED. I BELIEVE THAT'S VERY, VERY IMPORTANT. I DON'T THINK WE SHOULD HAVE JUSTICES APPOINTED THAT DECIDE WHAT THEY WANT TO HEAR. IT'S ALL ABOUT THE CONSTITUTION OF -- SO IMPORTANT, THE MEANT TO BE. AND THOSE ARE THE PEOPLE THAT I WILL APPOINT. >> MR. TRUMP, THANK YOU. NOW HAVE ABOUT TEN MINUTES FOR OPEN DISCUSSION, I WANT TO FOCUS ON TWO ISSUES THAT IN FACT BY THE JUSTICES THAT YOU NAMED COEND D UP CHANGING THE EXISTING LAW OF THE LAND. FIRST, IS ONE THAT YOU MENTIONED, MR. TRUMP, THAT IS GUNS. SECRETARY CLINTON YOU SAID LAST YEAR, LET ME QUOTE, THE SUPREME COURT IS WRONG ON THE 2nd AMENDMENT NOW IN FACT IN THE 2 THERE IS A CONSTITUTIONAL RIGHT TO BEAR ARMS, BUT A RIGHT THAT IS REASONABLY LIMITED. THOSE WERE THE WORDS OF THE JUDGE ANTONIN SCALIA, WHAT'S WRONG WITH THAT? >> WELL, FIRST OF ALL I SUPPORT THE 2nd AMENDMENT. I LIVED IN ARKANSAS FOR 18 WONDERFUL YEARS, I REPRESENTED"
826,188,1,FBC_20161020_040000_3rd_Presidential_Debate,https://archive.org/details/KQED_20161020_010000_PBS_NewsHour_Debates_2016_A_Special_Report#start/826/end/1014,"AGAINST ME. I REGRET THAT BECAUSE WHAT I WOULD LIKE TO SEE FOR PEOPLE TO COME TOGETHER AND SAY, OF COURSE, WE'RE GOING TO PROTECT AND DEFEND THE 2nd AMENDMENT. BUT WE'RE GOING TO DO IT IN A WAY THAT TRIES TO SAVE SOME OF THESE 43,000 LIVES THAT WE LOSE >> LET ME BRING MR. TRUMP BACK IN, BECAUSE IN FACT, YOU OPPOSED ANY LIMITS ON ASSAULT WEAPONS, ANY LIMITS ON HIGH CAPACITY MAGAZINES, YOU SUPPORT A NATIONAL RIGHT TO CARRY LAW. WHY, SIR? >>  LET ME JUST TELL YOU BEFORE WE GO ANY FURTHER IN CHICAGO, WHICH HAS THE TOUGHEST GUN LAWS IN THE UNITED STATES, PROBABLY YOU COULD SAY BY FAR, THEY HAVE MORE GUN VIOLENCE THAN ANY OTHER CITY. SO, WE HAVE THE TOUGHEST LAWS AND YOU HAVE TREMENDOUS GUN VIOLENCE. I AM A VERY STRONG SUPPORTER OF THE 2nd AMENDMENT, I DON'T KNOW IF HILLARY WAS SAYING IT IN SARCASTIC MANNER BUT I'M PROUD TO HAVE THE ENDORSEMENT OF THE NRA IS EARLIEST ENDORSEMENT IF HE OF THIS EVER GIVEN ANYBODY WHO RAN FOR PRESIDENT. I'M VERY HONORED BY ALL OF THAT. WE ARE GOING TO APPOINT JUSTICES, THIS IS THE BEST WAY TO HELP THE 2nd AMENDMENT, WE ARE GOING TO APPOINT JUSTICES THAT WILL FEEL VERY STRONGLY ABOUT THE 2nd AMENDMENT, THAT WILL NOT DO DAMAGE TO THE 2nd AMOUNTMENT. >> LET'S PICK UP ON ANOTHER ISSUE WHICH DIVIDES YOU. THE JUSTICE, IS THAT WHOEVER ENDS UP WINNING THAT ELECTION COULD HAVE DRAMATIC AFFECT THERE THAT'S THE ISSUE OF ABORTION. MR. TRUMP, YOU'RE PRO LIFE. I WOULDN'T ASK YOU SPECIFICALLY, DO YOU WANT THE COURT, INCLUDING THE JUSTICES THAT YOU WILL NAME, TO OVERTURN ROE V. WADE WHICH INCLUDES, IN FACT STATES, A WOMAN'S RIGHT TO ABORTION. BECAUSE I AM PRO LIFE I WILL BE APPOINTING PRO LIFE JUDGES I WOULD THINK THAT WILL GO BACK TO THE INDIVIDUAL STATES. >> I'M ASKING YOU SPECIFICALLY -- >> IF THEY OVERTURN IT WILL GO BACK TO THE STATES. >> WHAT I'M ASKING YOU, DO YOU WANT TO SEE THE COURT OVERTURN, YOU JUST SAID YOU WANT TO SEE THE COURT PROTECT THE 2nd AMENDMENT, DO YOU WANT TO SEE THE COURT OVERTURN -- >> IF WE PUT ANOTHER TWO OR PERHAPS THREE JUSTICES ON THAT'S REALLY WHAT IS GOING -- THAT'S WHAT WILL HAPPEN. THAT WILL HAPPEN AUTOMATICALLY IN MY OPINION BECAUSE I AM PUTTING PRO LIFE JUSTICES ON THE TO THE STATES AND THE STATES WILL MAKE A DETERMINATION. >> SECRETARY CLINTON? >> I STRONGLY SUPPORT ROE V. WADE WHICH GUARANTEES A CONSTITUTIONAL RIGHT TO A WOMAN TO MAKE THE MOST INTIMATE, MOST DIFFICULT IN MANY CASES DECISIONS ABOUT HER HEALTH CARE THAT ONE CAN IMAGINE. AND IN THIS CASE IT'S NOT ONLY ABOUT ROE V. WADE, IT IS ABOUT WHAT'S HAPPENING RIGHT NOW IN AMERICA. SO MANY STATES ARE PUTTING VERY STRINGENT REGULATIONS ON WOMEN, BUT BLOCK THEM FROM EXERCISING THAT CHOICE, TO THE EXTENT THAT THEY ARE DEFUNDING PLANNED PARENTHOOD, WHICH OF COURSE PROVIDES ALL KINDS OF CANCER SCREENINGS AND OTHER BENEFITS FOR WOMEN IN OUR COUNTRY. DONALD HALLS SAID HE'S IN FAVOR OF DEFUNDING PLANNED PARENTHOOD EVEN SUPPORTED SHUTTING THE GOVERNMENT DOWN TO DEFUND"
1014,21,2,"CNNW_20161020_023000_Debate_Night_in_America, FBC_20161020_040000_3rd_Presidential_Debate",https://archive.org/details/KQED_20161020_010000_PBS_NewsHour_Debates_2016_A_Special_Report#start/1014/end/1035,"PLANNED PARENTHOOD. I WILL DEFEND PLANNED PARENTHOOD. DEFEND WOMEN'S RIGHTS TO MAKE THEIR OWN HEALTHCARE DECISIONS. WE HAVE COME TOO FAR TO HAVE THAT TURNED BACK NOW. INDEED HE SAID WOMEN SHOULD BE PUNISHED, THAT THERE SHOULD BE SOME FORM OF PUNISHMENT FOR WOMEN WHO OBTAIN ADORESS I COULD"
1035,45,1,FBC_20161020_040000_3rd_Presidential_Debate,https://archive.org/details/KQED_20161020_010000_PBS_NewsHour_Debates_2016_A_Special_Report#start/1035/end/1080,"WOMEN WHO OBTAIN ADORESS I COULD JUST NOT BE MORE OPPOSED. >> I'M GOING TO GIVE YOU CHANCE TO RESPOND I WANT TO ASK YOU SECRETARY CLINTON EXPLORE HOW FAR YOU BELIEVE THE RIGHT TO ABORTION GOES. YOU HAVE BEEN QUOTED AS SAYING, THAT THE PEOPLE HAVE NO CONSTITUTIONAL RIGHTS, YOU ALSO QUOTED AGAINST A BAN ON LATE-TERM PARTIAL BIRTH ABORTIONS. WHY? >> BECAUSE, ROE V. WADE VERY CLEARLY SETS OUT THAT THERE CAN BE REGULATIONS ON ABORTION SO LONG AS THE LIFE AND THE HEALTH OF THE MOTHER ARE TAKEN INTO ACCOUNT. AND WHEN I VOTED, AS A SENATOR, I DID NOT THINK THAT THAT WAS THE CASE."
1093,26,1,FBC_20161020_040000_3rd_Presidential_Debate,https://archive.org/details/KQED_20161020_010000_PBS_NewsHour_Debates_2016_A_Special_Report#start/1093/end/1119,"THE WORST NEWS ONE COULD GET, THAT THEIR HEALTH IS IN JEOPARDY IF THEY CONTINUE TO CARRY TO TERM. OR THAT SOMETHING TERRIBLE HAS HAPPENED OR JUST BEEN DISCOVERED ABOUT THE PREGNANCY. I DO NOT THINK UNITED STATES GOVERNMENT SHOULD BE STEPPING IN AND MAKING THOSE MOST PERSONAL OF DECISIONS. SO, YOU CAN REGULATE, IF YOU ARE DOING SO WITH THE LIFE AND THE HEALTH OF THE MOTHER TAKEN INTO"
1119,29,2,"FBC_20161020_040000_3rd_Presidential_Debate, FOXNEWSW_20161020_010000_Presidential_Candidates_Debate",https://archive.org/details/KQED_20161020_010000_PBS_NewsHour_Debates_2016_A_Special_Report#start/1119/end/1148,"HEALTH OF THE MOTHER TAKEN INTO ACCOUNT. >> MR. TRUMP, YOUR REACTION, PARTICULARLY ON THIS ISSUE OF LATE-TERM PER SHALL BIRTH -- >> I THINK IT'S TERRIBLE IF YOU GO WITH WHAT HILLARY IS SAYING IN THE 9th MONTH YOU CAN TAKE THE BABY AND RIP THE BABY OUT OF THE WOMB OF THE MOTHER JUST PRIOR TO THE BIRTH OF THE BABY. NOW, YOU CAN SAY THAT THAS THAT'S OKAY. BUT IT'S NOT OKAY WITH ME. BECAUSE BASED ON WHAT SHE IS SAYING BASED ON WHERE SHE'S GOING AND WHERE SHE'S BEEN, YOU"
1148,60,1,FBC_20161020_040000_3rd_Presidential_Debate,https://archive.org/details/KQED_20161020_010000_PBS_NewsHour_Debates_2016_A_Special_Report#start/1148/end/1208,"CAN TAKE THE BABY AND RIP THE BABY OUT OF THE WOMB. IN THE 9th MONTH. ON THE FINAL DAY. THAT'S NOT ACCEPTABLE. >> THAT IS NOT WHAT HAPPENS IN THESE CASES. USING THAT KIND OF SCARE RHETORIC IS JUST TERRIBLY UNFORTUNATE. YOU SHOULD MEET WITH SOME OF THE WOMEN THAT I'VE MET WITH. WOMEN I'VE KNOWN OVER THE COURSE OF MY LIFE. THIS IS ONE OF THE WORST POSSIBLE CHOICES THAT ANY WOMAN AND HER FAMILY HAS TO MAKE. AND I DO NOT BELIEVE THE GOVERNMENT SHOULD BE MAKING IT. I'VE HAD THE GREAT HONOR OF TRAVELING ACROSS THE WORLD ON BEHALF OF OUR COUNTRY, I'VE BEEN TO COUNTRIES WHERE GOVERNMENT HAVE EITHER FORCED WOMEN TO HAVE ABORTIONS LIKE THEY USED TO DO IN CHINA OR FORCED WOMEN TO BEAR CHILDREN LIKE THEY USED TO DO IN ROMANIA. I CAN TELL YOU THE GOVERNMENT HAS NO BUSINESS IN THAT DECISION TH FAMILIES IN ACCORDANCE WITH THEIR FAITH, WITH MEDICAL ADVICE AND I WILL STAND UP FOR THAT RIGHT. >> ALL RIGHT. JUST BRIEFLY I'M GOING TO MOVE"
1359,8,1,CNNW_20161020_023000_Debate_Night_in_America,https://archive.org/details/KQED_20161020_010000_PBS_NewsHour_Debates_2016_A_Special_Report#start/1359/end/1367,"BAD, BAD PEOPLE IN THIS COUNTRY THAT HAVE TO GO OUT. WE'RE GOING TO GET THEM OUT, WE'RE GOING TO SECURITY BORDER AND ONCE THE BORDER IS SECURED AT A LATER DATE MAKE"
1428,48,1,FBC_20161020_040000_3rd_Presidential_Debate,https://archive.org/details/KQED_20161020_010000_PBS_NewsHour_Debates_2016_A_Special_Report#start/1428/end/1476,"A MASSIVE LAW ENFORCEMENT PRESENCE. WHERE LAW ENFORCEMENT OFFICERS WOULD BE GOING SCHOOL TO SCHOOL, HOME TO HOME, BUSINESS TO BUSINESS, ROUNDING UP PEOPLE WHO AND WE WOULD THEN HAVE TO PUT THEM ON TRAINS, ON BUSES, TO GET THEM OUT OF OUR COUNTRY. I THINK THAT IS AN IDEA THAT IS NOT IN KEEPING WITH WHO WE ARE AS A NATION. I THINK IT'S AN IDEA THAT WOULD RIP OUR COUNTRY APART. I HAVE BEEN FOR BORDER SECURITY FOR YEARS. I VOTED FOR BORDER SECURITY IN THE UNITED STATES SENATE. AND MY COMPREHENSIVE IMMIGRATION REFORM PLAN, OF COURSE INCLUDES BORDER SECURITY. BUT I WANT TO PUT OUR RESOURCES WHERE I THINK THEY ARE MOST NEEDED. GETTING RID OF ANY VIOLENT PERSON, ANYBODY WHO SHOULD BE"
1476,1,2,"FBC_20161020_040000_3rd_Presidential_Debate, FOXNEWSW_20161020_030000_The_Kelly_File",https://archive.org/details/KQED_20161020_010000_PBS_NewsHour_Debates_2016_A_Special_Report#start/1476/end/1477,"PERSON, ANYBODY WHO SHOULD BE"
1477,5,3,"FBC_20161020_040000_3rd_Presidential_Debate, KPIX_20161020_010000_CBS_News_The_Third_Presidential_Debate, FOXNEWSW_20161020_030000_The_Kelly_File",https://archive.org/details/KQED_20161020_010000_PBS_NewsHour_Debates_2016_A_Special_Report#start/1477/end/1482,"DEPORTED WE SHOULD DEPORT THEM. WHEN IT COMES TO THE WALL THAT DONALD TALKS ABOUT BUILDING, HE"
1482,1,2,"FBC_20161020_040000_3rd_Presidential_Debate, KPIX_20161020_010000_CBS_News_The_Third_Presidential_Debate",https://archive.org/details/KQED_20161020_010000_PBS_NewsHour_Debates_2016_A_Special_Report#start/1482/end/1483,"WENT TO MEXICO, HAD A MEETING"
1483,17,1,FBC_20161020_040000_3rd_Presidential_Debate,https://archive.org/details/KQED_20161020_010000_PBS_NewsHour_Debates_2016_A_Special_Report#start/1483/end/1500,"WENT TO MEXICO, HAD A MEETING WITH THE MEMBERS AN PRESIDENT, DIDN'T EVEN RAISE IT, HE CHOKED. THEN GOT INTO A TWITTER WAR BECAUSE THE MEXICAN PRESIDENT SAID WE'RE NOT PAYING FOR THAT WALL. I THINK WE ARE BOTH A NATION OF IMMIGRANTS AND WE ARE A NATION OF LAWS. AND THAT WE CAN ACT"
1519,4,1,FBC_20161020_040000_3rd_Presidential_Debate,https://archive.org/details/KQED_20161020_010000_PBS_NewsHour_Debates_2016_A_Special_Report#start/1519/end/1523,"DEALS, BELIEVE ME. THE NAFTA DEAL SIGNED BY HER HUSBAND IS ONE OF THE WORST"
1523,13,2,"FBC_20161020_040000_3rd_Presidential_Debate, FOXNEWSW_20161020_030000_The_Kelly_File",https://archive.org/details/KQED_20161020_010000_PBS_NewsHour_Debates_2016_A_Special_Report#start/1523/end/1536,"HUSBAND IS ONE OF THE WORST DEALS OF ANY KIND SIGNED BY ANYBODY, IT'S A DISASTER. HILLARY CLINTON WANTED THE WALL. HILLARY CLINTON FOUGHT FOR THE WALL. IN 2006 OR THEREABOUTS. NOW, SHE NEVER GETS ANYTHING"
1536,56,1,FBC_20161020_040000_3rd_Presidential_Debate,https://archive.org/details/KQED_20161020_010000_PBS_NewsHour_Debates_2016_A_Special_Report#start/1536/end/1592,"NOW, SHE NEVER GETS ANYTHING DONE SO NATURALLY THE WALL WASN'T BUILT. BUT HILLARY CLINTON WANTED THE WALL. >> LET ME -- WEARER COUNTRY -- LET ME -- BY THE WAY -- WAIT I'D LIKE TO HEAR -- I'D -- I'D LIKE TO HEAR FROM SECRETARY CLINTON. >> I VOTED FOR BORDER SECURITY. AND THERE ARE -- >> THE WALL. >> THERE SOME ARE LIMITED PLACES WHERE THAT WAS APPROPRIATE. THERE ARE ALSO NECESSARILY GOING BEST TO DEPLOY THAT. BUT IT IS CLEAR WHEN WE LOOK AT WHAT DONALD HAS BEEN PROPOSING, HE STARTED HIS CAMPAIGN BASHING IMMIGRANTS, CALLING MEXICAN IMMIGRANTS RACIST AND CRIMINALS AND DRUG DEALERS. THAT HE HAS A VERY DIFFERENT VIEW ABOUT WHAT WE SHOULD DO TO DEAL WITH IMMIGRANTS. NOW, WHAT I AM ALSO ARGUING IS THAT BRINGING UNDOCUMENTED IMMIGRANTS OUT FROM THE SHADOWS, PUTTING THEM INTO THE ECONOMY WILL BE GOOD, THEN EMPLOYERS CAN'T EXPLOIT THEM AND UNDERCUT"
1592,3,2,"CNNW_20161020_023000_Debate_Night_in_America, FBC_20161020_040000_3rd_Presidential_Debate",https://archive.org/details/KQED_20161020_010000_PBS_NewsHour_Debates_2016_A_Special_Report#start/1592/end/1595,"CAN'T EXPLOIT THEM AND UNDERCUT AMERICAN WAGES, DONALD KNOWS A LOT ABOUT THIS HE USED"
1595,6,1,CNNW_20161020_023000_Debate_Night_in_America,https://archive.org/details/KQED_20161020_010000_PBS_NewsHour_Debates_2016_A_Special_Report#start/1595/end/1601,"LOT ABOUT THIS HE USED UDOCUMENTED LABOR TO BUILD THE TRUMP TOWER. HE UNDERPAID UNDOCUMENTED WORKERS, WHEN THEY COMPLAINED,"
1656,10,1,CNNW_20161020_023000_Debate_Night_in_America,https://archive.org/details/KQED_20161020_010000_PBS_NewsHour_Debates_2016_A_Special_Report#start/1656/end/1666,"THAT SOMEBODY RUNS ACROSS THE BORDER, BECOMES A CITIZEN UNDER HER PLAN YOU HAVE OPEN BORDERS, YOU WOULD HAVE A DISASTER ON TRADE, YOU WILL HAVE A DISASTER WITH YOUR OPEN BOARDERS."
1690,85,1,FBC_20161020_040000_3rd_Presidential_Debate,https://archive.org/details/KQED_20161020_010000_PBS_NewsHour_Debates_2016_A_Special_Report#start/1690/end/1775,">> AND GEYER SUPPORTED IT AS WELL. >> I WANT TO SEE YOUR POSITION ON THIS ISSUE BECAUSE SPEECH YOU GAVE TO BRAZILIAN BANK FOR WHICH YOU WERE PAID $225,000 WE'VE LEARNED FROM THE WIKILEAK, IS THAT YOU SAID THIS. I WANT TO QUOTE. MY DREAM IS A HEMISPHERE RICK COMMON MARKET WITH OPEN TRADE AND OPEN BORDERS. >> THANK YOU. >> THAT'S THE QUESTION. PLEASE QUIET, EVERYBODY. IS THAT YOUR DREAM, OPEN BORDERS? >> WELL, IF YOU WENT TON READ THE REST OF THE SENTENCE I WAS TALKING ABOUT ENERGY. WE TRADE MORE ENERGY WITH OUR NEIGHBORS THAN WE TRADE WITH THE REST OF THE WORLD COMBINED. I DO WANT US TO HAVE AN ELECTRIC GRID, AN ENERGY SYSTEM THAT CROSSES BORDERS, I THINK THAT WILL BE GREAT BENEFIT TO US. QUOTING FROM WIKILEAKS WHAT IS REALLY IMPORTANT ABOUT WIKILEAKSS IS THAT THE RUSSIAN GOVERNMENT HAS ENGAGED IN ESPIONAGE AGAINST AMERICANS. THEY HAVE HACKED AMERICAN WEBSITES, AMERICAN ACCOUNTS OF PRIVATE PEOPLE, OF INSTITUTIONS. THEN THEY HAVE GIVEN THAT INFORMATION  WIKILEAKS FOR THE PURPOSE MUCH PUTTING IT ON THE INTERNET. THIS HAS COME FROM THE HIGHEST LEVELS OF THE RUSSIAN GOVERNMENT. CLEARLY FROM POUT IN HIMSELF, IN AN EFFORT AS 17 OF OUR"
1775,16,2,"FBC_20161020_040000_3rd_Presidential_Debate, FBC_20161020_030000_Cavuto_Coast_to_Coast",https://archive.org/details/KQED_20161020_010000_PBS_NewsHour_Debates_2016_A_Special_Report#start/1775/end/1791,"INTELLIGENCE AGENCIES HAVE CONFIRMED TO INFLUENCE OUR ELECTION. I ACTUALLY THINK THE MOST IMPORTANT QUESTION OF THIS EVENING, CHRIS, IS FINALLY WILL DONALD TRUMP ADMIT AND CONDEMN THAT THE RUSSIANS ARE DOING THIS. AND MAKE IT CLEAR THAT HE WILL"
1791,15,1,FBC_20161020_040000_3rd_Presidential_Debate,https://archive.org/details/KQED_20161020_010000_PBS_NewsHour_Debates_2016_A_Special_Report#start/1791/end/1806,"NOT HAVE THE HELP OF PUTIN IN THIS ELECTION, THAT HE REJ AMERICANS, WHICH HE ACTUALLY ENCOURAGED IN THE PAST. THOSE ARE THE QUESTIONS WE NEED ANSWERED."
1822,58,1,FBC_20161020_040000_3rd_Presidential_Debate,https://archive.org/details/KQED_20161020_010000_PBS_NewsHour_Debates_2016_A_Special_Report#start/1822/end/1880,"LET'S TRY TO KEEP IT QUIET FOR CANDIDATES AND FOR THE AMERICAN PEOPLE. >> JUST IS TO FINISH ON THE BORDERS SHE WANTS OPEN BORDERS, PEOPLE ARE GOING TO POUR INTO OUR COUNTRY. PEOPLE ARE GOING TO COME IN FROM SYRIA, SHE WANTS 550% MORE PEOPLE THAN BARACK OBAMA HE HAS THOUSANDS AND THOUSANDS OF PEOPLE THAT HAVE NO IDEA WHERE THEY COME FROM AND YOU SEE, WE ARE GOING TO STOP RADICAL ISLAMIC TERRORISM IN THIS COUNTRY. SHE WON'T EVEN MENTION THE WORDS, NEITHER WILL PRESIDENT OBAMA. I JUST WANT TO TELL YOU SHE WANTS OPEN BORDERS NOW WE CAN TALK ABOUT POUT IN. I DON'T KNOW POUT IN. HE SAID NICE THINGS. IF WE GOT ALONG WELL THAT WOULD GOT ALONG WELL WENT AFTER ISIS, THAT WOULD BE GOOD. HE HAS NO RESPECT FOR HER. HE HAS NO RESPECT FOR OUR PRESIDENT. I'LL TELL YOU WHAT, WE'RE IN VERY SERIOUS TROUBLE. BECAUSE WE HAVE A COUNTRY WITH TREMENDOUS NUMBERS OF NUCLEAR WARHEADS, 1800 BY THE WAY, WHERE THEY EXPANDED WE DIDN'T."
1880,3,2,"FBC_20161020_040000_3rd_Presidential_Debate, FOXNEWSW_20161020_010000_Presidential_Candidates_Debate",https://archive.org/details/KQED_20161020_010000_PBS_NewsHour_Debates_2016_A_Special_Report#start/1880/end/1883,"THEY EXPANDED WE DIDN'T."
1883,4,4,"FBC_20161020_040000_3rd_Presidential_Debate, FOXNEWSW_20161020_010000_Presidential_Candidates_Debate, MSNBCW_20161020_040000_MSNBC_Live_Post_Debate, CNBC_20161020_023000_Jay_Lenos_Garage",https://archive.org/details/KQED_20161020_010000_PBS_NewsHour_Debates_2016_A_Special_Report#start/1883/end/1887,"PLAYING CHICKEN. LOOK, PUTIN FROM EVERYTHING I"
1887,6,5,"FBC_20161020_040000_3rd_Presidential_Debate, FOXNEWSW_20161020_010000_Presidential_Candidates_Debate, FOXNEWSW_20161020_030000_The_Kelly_File, MSNBCW_20161020_040000_MSNBC_Live_Post_Debate, CNBC_20161020_023000_Jay_Lenos_Garage",https://archive.org/details/KQED_20161020_010000_PBS_NewsHour_Debates_2016_A_Special_Report#start/1887/end/1893,"LOOK, PUTIN FROM EVERYTHING I SEE HAVE 240 RESPECT FOR THIS PERSON. >> THAT'S BECAUSE HE'D RATHER"
1893,1,6,"CNNW_20161020_023000_Debate_Night_in_America, FBC_20161020_040000_3rd_Presidential_Debate, FOXNEWSW_20161020_010000_Presidential_Candidates_Debate, FOXNEWSW_20161020_030000_The_Kelly_File, MSNBCW_20161020_040000_MSNBC_Live_Post_Debate, CNBC_20161020_023000_Jay_Lenos_Garage",https://archive.org/details/KQED_20161020_010000_PBS_NewsHour_Debates_2016_A_Special_Report#start/1893/end/1894,"PERSON. >> THAT'S BECAUSE HE'D RATHER"
1894,1,5,"CNNW_20161020_023000_Debate_Night_in_America, FBC_20161020_040000_3rd_Presidential_Debate, FOXNEWSW_20161020_030000_The_Kelly_File, MSNBCW_20161020_040000_MSNBC_Live_Post_Debate, CNBC_20161020_023000_Jay_Lenos_Garage",https://archive.org/details/KQED_20161020_010000_PBS_NewsHour_Debates_2016_A_Special_Report#start/1894/end/1895,"HAVE A PUPPET AS PRESIDENT. >> NO PUPPET."
1895,2,4,"CNNW_20161020_023000_Debate_Night_in_America, FBC_20161020_040000_3rd_Presidential_Debate, MSNBCW_20161020_040000_MSNBC_Live_Post_Debate, CNBC_20161020_023000_Jay_Lenos_Garage",https://archive.org/details/KQED_20161020_010000_PBS_NewsHour_Debates_2016_A_Special_Report#start/1895/end/1897,"HAVE A PUPPET AS PRESIDENT. >> NO PUPPET."
1897,10,3,"CNNW_20161020_023000_Debate_Night_in_America, FBC_20161020_040000_3rd_Presidential_Debate, MSNBCW_20161020_040000_MSNBC_Live_Post_Debate",https://archive.org/details/KQED_20161020_010000_PBS_NewsHour_Debates_2016_A_Special_Report#start/1897/end/1907,">> IT'S PRETTY CLEAR -- YOU'RE THE PUPPET. >> IT'S CLEAR YOU WON'T ADMIT -- >>  YOU'RE THE PUPPET. >> RUSSIANS HAVE ENGAGED IN CYBERATTACKS AGAINST THE UNITED STATES OF AMERICA BUT YOU"
1907,6,4,"CNNW_20161020_023000_Debate_Night_in_America, FBC_20161020_040000_3rd_Presidential_Debate, FOXNEWSW_20161020_030000_The_Kelly_File, MSNBCW_20161020_040000_MSNBC_Live_Post_Debate",https://archive.org/details/KQED_20161020_010000_PBS_NewsHour_Debates_2016_A_Special_Report#start/1907/end/1913,"ENCOURAGE ESPYIANAGE AGAINST OUR PEOPLE THAT YOU ARE WILLING TO SPOUT THE PUTIN LINE, SIGN UP"
1913,7,3,"CNNW_20161020_023000_Debate_Night_in_America, FBC_20161020_040000_3rd_Presidential_Debate, FOXNEWSW_20161020_030000_The_Kelly_File",https://archive.org/details/KQED_20161020_010000_PBS_NewsHour_Debates_2016_A_Special_Report#start/1913/end/1920,"SPOUT THE PUTIN LINE, SIGN UP FOR HIS WISH LIST, RAKE UP NATO, DO WHATEVER HE WANTS TO"
1920,1,2,"CNNW_20161020_023000_Debate_Night_in_America, FBC_20161020_040000_3rd_Presidential_Debate",https://archive.org/details/KQED_20161020_010000_PBS_NewsHour_Debates_2016_A_Special_Report#start/1920/end/1921,
1921,36,1,FBC_20161020_040000_3rd_Presidential_Debate,https://archive.org/details/KQED_20161020_010000_PBS_NewsHour_Debates_2016_A_Special_Report#start/1921/end/1957,"HELP FROM HIM BECAUSE HE HAS A VERY CLEAR FAVORITE IN THIS RACE. I THINK THAT THIS IS SUCH AN UNPRECEDENTED SITUATION, WE'VE NEVER HAD A FOREIGN GOVERNMENT TRYING TO INTERFERE IN OUR ELECTION. WE HAVE 17 INTELLIGENCE AGENCI AGENCIES, CIVILIAN AND MILITARY WHO HAVE ALL CONCLUDED THAT THESE ESPIONAGE ATTACKS, THESE CYBERATTACKS COME FROM THE HIGHEST LEVELS OF THE KREMLIN AND THEY ARE DESIGNED TO INFLUENCE OUR ELECTION. I FIND THAT DEEPLY DISTURBING. >> SECRETARY CLINTON --"
1957,26,2,"CNNW_20161020_023000_Debate_Night_in_America, FBC_20161020_040000_3rd_Presidential_Debate",https://archive.org/details/KQED_20161020_010000_PBS_NewsHour_Debates_2016_A_Special_Report#start/1957/end/1983,">> SECRETARY CLINTON -- I HIT IT'S -- SHE HAS NO IDEA WHETHER IT'S RUSHA CHINA -- >> I'M NOT QUOTING MYSELF I AM -- >> YOU HAVE NO IDEA. >> -- DO YOU DOUBT 17 INTELLIGENCE -- >> HAVE NO IDEA. >> WELL, YOU HAVE -- VLADIMIR PUTIN THE MILITARY AND MILITARY INTELLIGENCE PROFESSIONA ARE SWORN TO PROTECT US. I FIND THAT --"
1983,8,1,FBC_20161020_040000_3rd_Presidential_Debate,https://archive.org/details/KQED_20161020_010000_PBS_NewsHour_Debates_2016_A_Special_Report#start/1983/end/1991,">> SHE DOESN'T LIKE PUTIN BECAUSE HE -- HE OUTSMARTED HER -- >> MR. TRUMP, EXCUSE ME. >> HE HAS OUTSMARTED HER IN --"
2004,2,1,FOXNEWSW_20161020_030000_The_Kelly_File,https://archive.org/details/KQED_20161020_010000_PBS_NewsHour_Debates_2016_A_Special_Report#start/2004/end/2006,"BEHIND THE ATTACKS."
2006,20,2,"FBC_20161020_040000_3rd_Presidential_Debate, FOXNEWSW_20161020_030000_The_Kelly_File",https://archive.org/details/KQED_20161020_010000_PBS_NewsHour_Debates_2016_A_Special_Report#start/2006/end/2026,"BEHIND THE ATTACKS. EVEN IF YOU DON'T KNOW FOR SURE WHETHER THEY ARE, DO YOU CONDEMN ANY INTERFERENCE BY RUSSIA IN THE AMERICAN ELECTION? >> BY RUSSIA OR ANYBODY ELSE. >> YOU CONDEMN THEY'RE INTERFERENCE. >> OF COURSE I CONDEMN. I DON'T KNOW PUTIN. >> I'M ASKING YOU -- THIS IS NOT MY BEST FRIEND. IF THE UNITED STATES GOT ALONG WITH RUSSIA COULDN'T BE SO BAD."
2026,48,1,FBC_20161020_040000_3rd_Presidential_Debate,https://archive.org/details/KQED_20161020_010000_PBS_NewsHour_Debates_2016_A_Special_Report#start/2026/end/2074,"WITH RUSSIA COULDN'T BE SO BAD. LET ME TELL YOU PUTIN HAS OUTSMARTED HER AND OBAMA AT EVERY SINGLE STEP OF THE WAY. WHETHER IT'S SYRIA. YOU NAME IT. MISSILES, TAKE A LOOK AT THE MANY, MANY REPORTS, I CAN'T BELIEVE THEY ALLOW THIS TO DO THIS. THEY CREATE WARHEADS WE CAN'T. RUSSIANS CAN'T BELIEVE IT. SHE HAS BEEN OUTSMARTED BY PUTIN ALL YOU HAVE TO DO LOOK AT THE MIDDLE EAST, THEY HAVE TAKEN OVER. WE'VE SPENT $TRILLION THEY HAVE TAKEN OVER THE MIDDLE EAST. SHE HAS BEEN OUTED SMARTED AND OUTPLAYED WORSE THAN ANYBODY I'VE EVER SEEN IN ANY GOVERNMENT WHATSOEVER. >> WE'RE A LONG WAY AWAY FROM IMMIGRATION BUT I'M GOING TO LET YOU FINISH THIS -- 45 SECONDS. >> SHE ALWAYS WILL BE. >> I FIND IT IRONIC THAT HE'S"
