debate_media,coverage_media,debate_start_second,coverage_start_second,duration,match_url,transcript
KNTV_20160927_010000_NBC_News_Special_2016_Presidential_Debate_1,FOXNEWSW_20160927_030000_The_Kelly_File,2198.2,604.7,35,https://archive.org/details/FOXNEWSW_20160927_030000_The_Kelly_File#start/604.7/end/639.7,">> I DO. YOU KNOW, I MADE A MISTAKE USING A PRIVATE E-MAIL. >> THAT'S FOR SURE. >> AND IF I HAD TO DO IT OVER AGAIN, I WOULD OBVIOUSLY DO IT DIFFERENTLY, BUT I'M NOT GOING TO MAKE ANY EXCUSES. IT WAS A MISTAKE AND I TAKE RESPONSIBILITY FOR THAT. >> MR. TRUMP? >> THAT WAS MORE THAN A MISTAKE. THAT WAS DONE PURPOSELY. OKAY? THAT WAS NOT A MISTAKE. THAT WAS DONE PURPOSELY. WHEN YOU HAVE YOUR STAFF TAKING THE 5th AMENDMENT, TAKING THE PROSECUTED, WHEN YOU HAVE THE MAN THAT SET UP THE ILLEGAL SERVER TAKING THE 5th, I"
KNTV_20160927_010000_NBC_News_Special_2016_Presidential_Debate_1,FOXNEWSW_20160927_030000_The_Kelly_File,2382.7,2189.2,17.6,https://archive.org/details/FOXNEWSW_20160927_030000_The_Kelly_File#start/2189.2/end/2206.8,"IMPORTANT -- >> IT WOULD BE SQUANDERED, TOO, BELIEVE ME. >> -- IS IF YOUR MAIN CLAIM TO BE PRESIDENT OF THE UNITED STATES IS YOUR BUSINESS, THEN I THINK WE SHOULD TALK ABOUT THAT. YOU KNOW, YOUR CAMPAIGN MANAGER SAID THAT YOU BUILT A LOT OF BUSINESSES ON THE BACKS OF LITTLE GUYS, AND INDEED, I HAVE MET"
KNTV_20160927_010000_NBC_News_Special_2016_Presidential_Debate_1,FOXNEWSW_20160927_030000_The_Kelly_File,2422.9,2210.3,27.3,https://archive.org/details/FOXNEWSW_20160927_030000_The_Kelly_File#start/2210.3/end/2237.6,"WORK THAT YOU ASKED THEM TO DO. WE HAVE AN ARCHITECT IN THE AUDIENCE WHO DESIGNED ONE OF YOUR CLUBHOUSES AT ONE OF YOUR GOLF COURSES. IT'S A BEAUTIFUL FACILITY. IT IMMEDIATELY WAS PUT TO USE. AND YOU WOULDN'T PAY WHAT THE MAN NEEDED TO BE PAID WHAT HE WAS CHARGING YOU -- >> MAYBE HE DIDN'T DO A GOOD JOB AND I WAS UNSATISFIED WITH HIS WORK WHICH OUR COUNTRY SHOULD DO, TOO. >> THE THOUSANDS OF PEOPLE THAT YOU HAVE STIFFED OVER THE COURSE OF YOUR"
KNTV_20160927_010000_NBC_News_Special_2016_Presidential_Debate_1,FOXNEWSW_20160927_030000_The_Kelly_File,2537.9,2241.7,21.9,https://archive.org/details/FOXNEWSW_20160927_030000_The_Kelly_File#start/2241.7/end/2263.6,"THAT ARE THERE AND WHEN SECRETARY CLINTON TALKS ABOUT PEOPLE THAT DIDN'T GET PAID, FIRST OF ALL, THEY DID GET PAID A LOT, BUT TAKING ADVANTAGE OF THE LAWS OF THE NATION. NOW, IF YOU WANT TO CHANGE THE LAWS, YOU'VE BEEN THERE A LONG TIME, CHANGE THE LAW. BUT I TAKE ADVANTAGE OF THE LAWS OF THE NATION BECAUSE I'M RUNNING A COMPANY, MY"
KNTV_20160927_010000_NBC_News_Special_2016_Presidential_Debate_1,FOXNEWSW_20160927_030000_The_Kelly_File,3232.3,151.8,10.8,https://archive.org/details/FOXNEWSW_20160927_030000_The_Kelly_File#start/151.8/end/162.6,">> SECRETARY CLINTON, LAST WEEK YOU SAID WE'VE GOT DO EVERYTHING POSSIBLE TO IMPROVE POLICING TO GO RIGHT AT IMPLICIT BIAS. DO YOU BELIEVE THAT POLICE ARE IMPLICITLY BIASED AGAINST BLACK"
KNTV_20160927_010000_NBC_News_Special_2016_Presidential_Debate_1,FOXNEWSW_20160927_030000_The_Kelly_File,3396.3,1596.2,18.9,https://archive.org/details/FOXNEWSW_20160927_030000_The_Kelly_File#start/1596.2/end/1615.1,"TERMINATED BY CURRENT MAYOR. BUT STOP AND FRISK HAD A TREMENDOUS IMPACT ON THE SAFETY OF NEW YORK CITY, TREMENDOUS BEYOND BELIEF. SO WHEN YOU SAY IT HAS NO IMPACT, IT REALLY DID. IT HAD A VERY, VERY BIG IMPACT. >> WELL, IT'S ALSO FAIR TO SAY, IF WE'RE GOING TO TALK ABOUT MAYORS, THAT UNDER THE CURRENT MAYOR, CRIME HAS CONTINUED TO DROP"
KNTV_20160927_010000_NBC_News_Special_2016_Presidential_Debate_1,FOXNEWSW_20160927_030000_The_Kelly_File,4755.1,1066.9,25.8,https://archive.org/details/FOXNEWSW_20160927_030000_The_Kelly_File#start/1066.9/end/1092.7,"FAST. WHEN ISIS FORMED IN THIS VACUUM CREATED BY BARACK OBAMA AND SECRETARY CLINTON, AND BELIEVE ME, YOU WERE THE ONES THAT TOOK OUT THE TROOPS. NOT ONLY THAT, YOU NAMED THE DAY. THEY COULDN'T BELIEVE IT. THEY SAT BACK PROBABLY AND SAID -- >> LESTER, WE COVERED THIS -- >> WAIT A MINUTE. THEY SAID WAIT A MINUTE, WHEN THEY FORMED, THIS IS SOMETHING THAT NEVER SHOULD HAVE HAPPENED. IT NEVER SHOULD HAVE HAPPENED. NOW YOU'RE TALKING"
KNTV_20160927_010000_NBC_News_Special_2016_Presidential_Debate_1,FOXNEWSW_20160927_030000_The_Kelly_File,4789.1,2677.7,35.7,https://archive.org/details/FOXNEWSW_20160927_030000_The_Kelly_File#start/2677.7/end/2713.4,"I DON'T THINK SO. >> MR. TRUMP, WITH A LOT OF THESE ARE JUDGMENT QUESTIONS. YOU HAD SUPPORTED THE WAR IN IRAQ BEFORE THE INVASION. WHAT MAKES YOUR -- >> I DID NOT SUPPORT THE WAR IN IRAQ. >> 2002 -- >> THAT IS A MAINSTREAM MEDIA NONSENSE PUT OUT BY HER BECAUSE SHE FRANKLY I THINK THE BEST PERSON IN HER CAMPAIGN IS MAINSTREAM MEDIA. >> MY QUESTION -- >> WOULD YOU LIKE TO HEAR? I WAS AGAINST -- WAIT A MINUTE. I WAS AGAINST THE WAR IN IRAQ. JUST SO YOU PUT IT OUT. >> THE RECORD SHOWS OTHERWISE. WHY -- >> THE RECORD DOES NOT SHOW -- >> WHY IS YOUR JUDGMENT ANY -- >> THE RECORD SHOWS THAT I'M RIGHT. WHEN I DID AN INTERVIEW WITH HOWARD STERN, VERY LIKELY"
KNTV_20160927_010000_NBC_News_Special_2016_Presidential_Debate_1,WCAU_20160927_030000_NBC10_News_at_11pm,587.8,154.6,6,https://archive.org/details/WCAU_20160927_030000_NBC10_News_at_11pm#start/154.6/end/160.6,"TO DO, BUT PERHAPS WE'LL BE TALKING ABOUT THAT LATER. BUT WE HAVE TO STOP OUR JOBS FROM BEING STOLEN FROM US."
KNTV_20160927_010000_NBC_News_Special_2016_Presidential_Debate_1,WCAU_20160927_030000_NBC10_News_at_11pm,1541,728.1,17.6,https://archive.org/details/WCAU_20160927_030000_NBC10_News_at_11pm#start/728.1/end/745.7,"DIFFERENT THAN THIS. SHE'S TELLING US HOW TO FIGHT ISIS. GO TO HER WEBSITE. SHE TELLS YOU HOW TO FIGHT ISIS ON HER WEBSITE. I DON'T THINK GENERAL DOUGLAS MacARTHUR WOULD LIKE THAT TOO MUCH. >> THE NEXT SEGMENT -- >> AT LEAST I HAVE A PLAN TO FIGHT ISIS. >> NO, NO, YOU'RE TELLING THE ENEMY EVERYTHING I WANT TO"
KNTV_20160927_010000_NBC_News_Special_2016_Presidential_Debate_1,WCAU_20160927_030000_NBC10_News_at_11pm,1972.9,173.2,9.6,https://archive.org/details/WCAU_20160927_030000_NBC10_News_at_11pm#start/173.2/end/182.8,"ARE POLITICAL HACKS NEGOTIATING OUR TRADE DEALS. >> THE IRS SAYS AN AUDIT OF YOUR TAXES -- YOU'RE PERFECTLY FREE TO RELEASE YOUR TAXES DURING AN AUDIT. SO THE QUESTION, DOES"
KNTV_20160927_010000_NBC_News_Special_2016_Presidential_Debate_1,WCAU_20160927_030000_NBC10_News_at_11pm,2197.6,191.2,6,https://archive.org/details/WCAU_20160927_030000_NBC10_News_at_11pm#start/191.2/end/197.2,"YOU WANT TO RESPOND TO THAT? >> I DO. YOU KNOW, I MADE A MISTAKE USING A PRIVATE E-MAIL."
KNTV_20160927_010000_NBC_News_Special_2016_Presidential_Debate_1,WCAU_20160927_030000_NBC10_News_at_11pm,2879.7,211.4,8.2,https://archive.org/details/WCAU_20160927_030000_NBC10_News_at_11pm#start/211.4/end/219.6,"PRESIDENT. OVER -- ALMOST 4,000 PEOPLE IN CHICAGO HAVE BEEN KILLED. WE HAVE TO BRING BACK LAW AND ORDER. NOW, WHETHER OR NOT IN A PLACE LIKE CHICAGO YOU DO STOP AND FRISK,"
KNTV_20160927_010000_NBC_News_Special_2016_Presidential_Debate_1,WCAU_20160927_030000_NBC10_News_at_11pm,3520.4,1406.7,3.9,https://archive.org/details/WCAU_20160927_030000_NBC10_News_at_11pm#start/1406.7/end/1410.6,"DETROIT AND I JUST LEFT PHILADELPHIA AND I JUST -- YOU KNOW,"
KNTV_20160927_010000_NBC_News_Special_2016_Presidential_Debate_1,WCAU_20160927_030000_NBC10_News_at_11pm,3539.4,1412.9,11.7,https://archive.org/details/WCAU_20160927_030000_NBC10_News_at_11pm#start/1412.9/end/1424.6,"TOLD THEM AND WHAT THEIR POLITICIANS HAVE DONE. >> MR. TRUMP -- >> I THINK DONALD JUST CRITICIZED ME FOR PREPARING FOR THIS DEBATE. AND YES, I DID."
KNTV_20160927_010000_NBC_News_Special_2016_Presidential_Debate_1,WCAU_20160927_030000_NBC10_News_at_11pm,3664.2,225.6,6.2,https://archive.org/details/WCAU_20160927_030000_NBC10_News_at_11pm#start/225.6/end/231.8,"I FIGURED YOU'D ASK THE QUESTION TONIGHT, OF COURSE. BUT NOBODY WAS CARING MUCH ABOUT IT. BUT I WAS THE ONE THAT"
KNTV_20160927_010000_NBC_News_Special_2016_Presidential_Debate_1,WCAU_20160927_030000_NBC10_News_at_11pm,3750.1,234.1,6.6,https://archive.org/details/WCAU_20160927_030000_NBC10_News_at_11pm#start/234.1/end/240.7,"AND LESTER HOLT WAS GOING TO BE ASKING US QUESTIONS, SO HE TRIED TO PUT THE WHOLE"
KNTV_20160927_010000_NBC_News_Special_2016_Presidential_Debate_1,WCAU_20160927_030000_NBC10_News_at_11pm,4792.3,313.7,23.8,https://archive.org/details/WCAU_20160927_030000_NBC10_News_at_11pm#start/313.7/end/337.5,"JUDGMENT QUESTIONS. YOU HAD SUPPORTED THE WAR IN IRAQ BEFORE THE INVASION. WHAT MAKES YOUR -- >> I DID NOT SUPPORT THE WAR IN IRAQ. >> 2002 -- >> THAT IS A MAINSTREAM MEDIA NONSENSE PUT OUT BY HER BECAUSE SHE FRANKLY I THINK THE BEST PERSON IN HER CAMPAIGN IS MAINSTREAM MEDIA. >> MY QUESTION -- >> WOULD YOU LIKE TO HEAR? I WAS AGAINST -- WAIT A MINUTE. I WAS AGAINST THE WAR IN IRAQ. JUST SO YOU PUT IT OUT."
KNTV_20160927_010000_NBC_News_Special_2016_Presidential_Debate_1,WCAU_20160927_030000_NBC10_News_at_11pm,5637.9,887.2,20.8,https://archive.org/details/WCAU_20160927_030000_NBC10_News_at_11pm#start/887.2/end/908,"AND I DON'T BELIEVE THAT HILLARY HAS THE STAMINA. >> LET'S LET HER RESPOND. >> WELL, AS SOON AS HE TRAVELS TO 112 COUNTRIES AND NEGOTIATES A PEACE DEAL, A CEASE-FIRE, A RELEASE OF DISSIDENTS, AN OPENING OF NEW OPPORTUNITIES IN"
KNTV_20160927_010000_NBC_News_Special_2016_Presidential_Debate_1,KYW_20160927_110000_CBS_This_Morning,615.3,3731.9,8.5,https://archive.org/details/KYW_20160927_110000_CBS_This_Morning#start/3731.9/end/3740.4,"UNDER MY PLAN, I'LL BE REDUCING TAXES TREMENDOUSLY FROM 35% TO 15% FOR COMPANIES,"
KNTV_20160927_010000_NBC_News_Special_2016_Presidential_Debate_1,KYW_20160927_110000_CBS_This_Morning,689.4,3745.2,28.7,https://archive.org/details/KYW_20160927_110000_CBS_This_Morning#start/3745.2/end/3773.9,"THAT IS NOT HOW WE GROW THE ECONOMY. WE JUST HAVE A DIFFERENT VIEW ABOUT WHAT'S BEST FOR GROWING THE ECONOMY. HOW WE MAKE INVESTMENTS THAT WILL ACTUALLY PRODUCE JOBS AND RISING INCOMES. I THINK WE COME AT IT FROM SOMEWHAT DIFFERENT PERSPECTIVES. I UNDERSTAND THAT. YOU KNOW, DONALD WAS VERY FORTUNATE IN HIS LIFE AND THAT'S ALL TO HIS BENEFIT. HE STARTED HIS BUSINESS WITH $14 MILLION, BORROWED FROM HIS FATHER, AND HE REALLY BELIEVES THAT THE MORE YOU HELP"
KNTV_20160927_010000_NBC_News_Special_2016_Presidential_Debate_1,KYW_20160927_110000_CBS_This_Morning,771.9,3777.7,9.1,https://archive.org/details/KYW_20160927_110000_CBS_This_Morning#start/3777.7/end/3786.8,"THING, AND BEFORE WE START ON THAT, MY FATHER GAVE ME A VERY SMALL LOAN IN 1975 AND I BUILT IT INTO A COMPANY THAT'S WORTH MANY, MANY BILLIONS OF DOLLARS WITH SOME OF THE GREATEST ASSETS IN"
KNTV_20160927_010000_NBC_News_Special_2016_Presidential_Debate_1,KYW_20160927_110000_CBS_This_Morning,1260.3,253.8,3.8,https://archive.org/details/KYW_20160927_110000_CBS_This_Morning#start/253.8/end/257.6,">> YOU HAVEN'T DONE IT IN 30 YEARS OR 26 YEARS."
KNTV_20160927_010000_NBC_News_Special_2016_Presidential_Debate_1,KYW_20160927_110000_CBS_This_Morning,1288.4,544,2.2,https://archive.org/details/KYW_20160927_110000_CBS_This_Morning#start/544/end/546.2,NA
KNTV_20160927_010000_NBC_News_Special_2016_Presidential_Debate_1,KYW_20160927_110000_CBS_This_Morning,1308.1,555.9,9.1,https://archive.org/details/KYW_20160927_110000_CBS_This_Morning#start/555.9/end/565,"BAD AS NAFTA. NOTHING WILL TOP NANAFA. >> THAT IS NOT ACCURATE. I WAS AGAINST IT ONCE IT WAS FINALLY NEGOTIATED."
KNTV_20160927_010000_NBC_News_Special_2016_Presidential_Debate_1,KYW_20160927_110000_CBS_This_Morning,1322.3,3692.5,4,https://archive.org/details/KYW_20160927_110000_CBS_This_Morning#start/3692.5/end/3696.5,"YOU KACALLED IT THE GOLD STANDARD OF TRADE DEALS."
KNTV_20160927_010000_NBC_News_Special_2016_Presidential_Debate_1,KYW_20160927_110000_CBS_This_Morning,1554.6,491.8,7.6,https://archive.org/details/KYW_20160927_110000_CBS_This_Morning#start/491.8/end/499.4,"PLAN TO FIGHT ISIS. >> NO, NO, YOU'RE TELLING THE ENEMY EVERYTHING I WANT TO DO. >> NO, WE'RE NOT. >> SEE, YOU TELLING THE ENEMY EVERYTHING YOU WANT TO DO. NO WONDER YOU'VE,"
KNTV_20160927_010000_NBC_News_Special_2016_Presidential_Debate_1,KYW_20160927_110000_CBS_This_Morning,2010.8,288.5,10,https://archive.org/details/KYW_20160927_110000_CBS_This_Morning#start/288.5/end/298.5,"THIS COUNTRY THAT HAS TO BE TAKEN CARE OF. I WILL RELEASE MY TAX RETURNS AGAINST MY LAWYER'S WISHES. WHEN SHE RELEASES HER"
KNTV_20160927_010000_NBC_News_Special_2016_Presidential_Debate_1,KYW_20160927_110000_CBS_This_Morning,2011,2244.3,15.1,https://archive.org/details/KYW_20160927_110000_CBS_This_Morning#start/2244.3/end/2259.4,"THIS COUNTRY THAT HAS TO BE TAKEN CARE OF. I WILL RELEASE MY TAX RETURNS AGAINST MY LAWYER'S WISHES. WHEN SHE RELEASES HER HAVE BEEN DELETED. AS SOON AS SHE RELEASES THEM, I WILL RELEASE -- I WILL"
KNTV_20160927_010000_NBC_News_Special_2016_Presidential_Debate_1,KYW_20160927_110000_CBS_This_Morning,2086.9,3795,47.3,https://archive.org/details/KYW_20160927_110000_CBS_This_Morning#start/3795/end/3842.3,"RETURNS? AND I THINK THERE MAY BE A COUPLE OF REASONS. FIRST, MAYBE HE'S NOT AS RICH AS HE SAYS HE IS. SECOND, MAYBE HE'S NOT AS CHARITABLE AS HE CLAIMS TO BE. THIRD, WE DON'T KNOW ALL OF HIS BUSINESS DEALINGS, BUT WE HAVE BEEN TOLD THROUGH INVESTIGATIVE REPORTING THAT HE OWES ABOUT $650 MILLION TO WALL STREET AND FOREIGN BANKS. OR MAYBE HE DOESN'T WANT THE AMERICAN PEOPLE, ALL OF YOU WATCHING TONIGHT, TO KNOW THAT HE'S PAID NOTHING IN FEDERAL TAXES BECAUSE THE ONLY YEARS THAT ANYBODY'S EVER SEEN WERE A COUPLE OF YEARS WHEN HE HAD TO TURN THEM OVER TO STATE AUTHORITIES WHEN HE WAS TRYING TO GET A CASINO LICENSE AND THEY SHOWED HE DIDN'T PAY ANY FEDERAL INCOME TAX. >> THAT MAKES ME SMART. >> IF HE'S PAID ZERO, THAT MEANS ZERO FOR"
KNTV_20160927_010000_NBC_News_Special_2016_Presidential_Debate_1,KYW_20160927_110000_CBS_This_Morning,2285.6,3845.6,10,https://archive.org/details/KYW_20160927_110000_CBS_This_Morning#start/3845.6/end/3855.6,"INSTITUTIONS, VERY FINE BANKS. I COULD DO THAT VERY QUICKLY. I'M VERY UNDERLEVERAGED. I HAVE A GREAT COMPANY. I HAVE A TREMENDOUS INCOME. THE REASON I SAY THAT IS NOT IN A"
KNTV_20160927_010000_NBC_News_Special_2016_Presidential_Debate_1,KYW_20160927_110000_CBS_This_Morning,2367.4,70,8.7000000000003,https://archive.org/details/KYW_20160927_110000_CBS_This_Morning#start/70/end/78.7,"BRIDGES, NEW AIRPORTS, NEW SCHOOLS, NEW HOSPITALS. AND WE DON'T HAVE THE MONEY BECAUSE IT'S BEEN SQUANDERED ON SO MANY OF YOUR IDEAS. >> LET YOU RESPOND --"
KNTV_20160927_010000_NBC_News_Special_2016_Presidential_Debate_1,KYW_20160927_110000_CBS_This_Morning,2926.9,517.6,13.3,https://archive.org/details/KYW_20160927_110000_CBS_This_Morning#start/517.6/end/530.9,">> YOUR TWO MINUTES HAS EXPIRED. I DO WANT TO FOLLOW-UP. STOP AND FRISK WAS RULED UNCONSTITUTIONAL IN NEW YORK BECAUSE IT LARGELY SINGLED OUT BLACK AND HISPANIC YOUNG MEN. >> NO, YOU'RE WRONG. IT WENT BEFORE A JUDGE"
KNTV_20160927_010000_NBC_News_Special_2016_Presidential_Debate_1,KYW_20160927_110000_CBS_This_Morning,3646.7,2314.5,24.5,https://archive.org/details/KYW_20160927_110000_CBS_This_Morning#start/2314.5/end/2339,"RESPOND. THAT'S THE POINT. I WANT TO GET THE ANSWER HERE. THE BIRTH CERTIFICATE WAS PRODUCED IN 2011. YOU CONTINUED TO TELL THE STORY AND QUESTION THE PRESIDENT'S LEGITIMACY IN 2012, RECENTLY AS JANUARY. THE QUESTION IS WHAT CHANGED YOUR MIND? >> WELL, NOBODY WAS PRESSING IT. NOBODY WAS CARING MUCH ABOUT IT. I FIGURED YOU'D ASK THE QUESTION TONIGHT, OF COURSE. BUT NOBODY WAS CARING MUCH ABOUT IT. BUT I WAS THE ONE THAT GOT HIM TO PRODUCE THE"
KNTV_20160927_010000_NBC_News_Special_2016_Presidential_Debate_1,KYW_20160927_110000_CBS_This_Morning,3727.7,323.3,6.2,https://archive.org/details/KYW_20160927_110000_CBS_This_Morning#start/323.3/end/329.5,"REALLY WANTED ME TO COME TO THAT CONCLUSION AND I THINK I DID A GREAT JOB AND A GREAT SERVICE NOT"
KNTV_20160927_010000_NBC_News_Special_2016_Presidential_Debate_1,KYW_20160927_110000_CBS_This_Morning,4936,345.2,4.4,https://archive.org/details/KYW_20160927_110000_CBS_This_Morning#start/345.2/end/349.6,"AVENUE INTO A ROOM, THEY PUT NAMES -- OH, TEMPERAMENT, LET'S GO AFTER IT."
KNTV_20160927_010000_NBC_News_Special_2016_Presidential_Debate_1,KYW_20160927_110000_CBS_This_Morning,4953.1,1815.1,7.4,https://archive.org/details/KYW_20160927_110000_CBS_This_Morning#start/1815.1/end/1822.5,"TO, SECRETARY CLINTON, BUT YOU WERE TOTALLY OUT OF CONTROL. I SAID, THERE'S A PERSON WITH A TEMPERAMENT THAT'S GOT"
KNTV_20160927_010000_NBC_News_Special_2016_Presidential_Debate_1,KYW_20160927_110000_CBS_This_Morning,5595.5,261.4,2.2,https://archive.org/details/KYW_20160927_110000_CBS_This_Morning#start/261.4/end/263.6,"SHE'S STANDING HERE RIGHT NOW. WHAT DID YOU MEAN BY"
KNTV_20160927_010000_NBC_News_Special_2016_Presidential_Debate_1,KYW_20160927_110000_CBS_This_Morning,5642.2,264.3,21.3,https://archive.org/details/KYW_20160927_110000_CBS_This_Morning#start/264.3/end/285.6,"RESPOND. >> WELL, AS SOON AS HE TRAVELS TO 112 COUNTRIES AND NEGOTIATES A PEACE DEAL, A CEASE-FIRE, A RELEASE OF DISSIDENTS, AN OPENING OF NEW OPPORTUNITIES IN NATIONS AROUND THE WORLD, OR EVEN SPENDS FRONT OF A"
KNTV_20160927_010000_NBC_News_Special_2016_Presidential_Debate_1,KYW_20160927_110000_CBS_This_Morning,5712.6,579.9,7.5,https://archive.org/details/KYW_20160927_110000_CBS_This_Morning#start/579.9/end/587.4,"BUT THIS IS A MAN WHO HAS CALLED WOMEN PIGS, SLOBS, AND DOGS AND SOMEONE WHO HAS SAID"
KNTV_20160927_010000_NBC_News_Special_2016_Presidential_Debate_1,KYW_20160927_110000_CBS_This_Morning,5713.7,4030,14.2,https://archive.org/details/KYW_20160927_110000_CBS_This_Morning#start/4030/end/4044.2,"BUT THIS IS A MAN WHO HAS CALLED WOMEN PIGS, SLOBS, AND DOGS AND SOMEONE WHO HAS SAID PREGNANCY IS AN INCONVENIENCE TO EMPLOYERS. WHO HAS SAID --"
KNTV_20160927_010000_NBC_News_Special_2016_Presidential_Debate_1,KYW_20160927_110000_CBS_This_Morning,5766.6,4047,10.4,https://archive.org/details/KYW_20160927_110000_CBS_This_Morning#start/4047/end/4057.4,"SECONDS THEN WE'LL HAVE THE FINAL QUESTION. >> YOU KNOW, HILLARY IS HITTING ME WITH TREMENDOUS COMMERCIALS. SOME OF IT'S SAID IN ENTERTAINMENT, SOME OF IT SAID, SOMEBODY WHO'S BEEN VERY VICIOUS TO ME, ROSIE O'DONNELL, I SAID VERY"
KNTV_20160927_010000_NBC_News_Special_2016_Presidential_Debate_1,KYW_20160927_030000_Eyewitness_News_at_11,666.1,954.4,5.8,https://archive.org/details/KYW_20160927_030000_Eyewitness_News_at_11#start/954.4/end/960.2,"NOT JUST FINANCIAL TRANSACTIONS. AND THE KIND OF PLAN THAT DONALD HAS PUT"
KNTV_20160927_010000_NBC_News_Special_2016_Presidential_Debate_1,KYW_20160927_030000_Eyewitness_News_at_11,1265.6,88.3,5.5,https://archive.org/details/KYW_20160927_030000_Eyewitness_News_at_11#start/88.3/end/93.8,">> YOU HAVEN'T DONE IT. YOU HAVEN'T DONE IT. >> I'VE BEEN SECRETARY OF STATE. >> EXCUSE ME, YOUR"
KNTV_20160927_010000_NBC_News_Special_2016_Presidential_Debate_1,KYW_20160927_030000_Eyewitness_News_at_11,1549.3,18,5.5,https://archive.org/details/KYW_20160927_030000_Eyewitness_News_at_11#start/18/end/23.5,"I DON'T THINK GENERAL DOUGLAS MacARTHUR WOULD LIKE THAT TOO MUCH. >> THE NEXT SEGMENT -- >> AT LEAST I HAVE A"
KNTV_20160927_010000_NBC_News_Special_2016_Presidential_Debate_1,KYW_20160927_030000_Eyewitness_News_at_11,1694.5,60.1,4.1,https://archive.org/details/KYW_20160927_030000_Eyewitness_News_at_11#start/60.1/end/64.2,"INCREASES ON THE WEALTHIEST AMERICANS, SECRETARY CLINTON."
KNTV_20160927_010000_NBC_News_Special_2016_Presidential_Debate_1,KYW_20160927_030000_Eyewitness_News_at_11,1768.2,79.3,8,https://archive.org/details/KYW_20160927_030000_Eyewitness_News_at_11#start/79.3/end/87.3,">> HOW MUCH, HOW MUCH? LESTER, HOW MUCH? >> IT S AS I SAID, TRUMPED UP TRICKLE DOWN. TRICKLE DOWN DID NOT WORK. IT GOT US INTO THE"
KNTV_20160927_010000_NBC_News_Special_2016_Presidential_Debate_1,KYW_20160927_030000_Eyewitness_News_at_11,2010.9,100.1,12.6,https://archive.org/details/KYW_20160927_030000_Eyewitness_News_at_11#start/100.1/end/112.7,"THIS COUNTRY THAT HAS TO BE TAKEN CARE OF. I WILL RELEASE MY TAX RETURNS AGAINST MY LAWYER'S WISHES. WHEN SHE RELEASES HER HAVE BEEN DELETED. AS SOON AS SHE"
KNTV_20160927_010000_NBC_News_Special_2016_Presidential_Debate_1,KYW_20160927_030000_Eyewitness_News_at_11,2162.3,118.8,12.1,https://archive.org/details/KYW_20160927_030000_Eyewitness_News_at_11#start/118.8/end/130.9,"AND IT JUST SEEMS TO ME THAT THIS IS SOMETHING THAT THE AMERICAN PEOPLE DESERVE TO SEE AND I HAVE NO REASON TO BELIEVE THAT HE'S EVER GOING TO RELEASE HIS TAX RETURNS BECAUSE THERE'S SOMETHING HE'S"
KNTV_20160927_010000_NBC_News_Special_2016_Presidential_Debate_1,KYW_20160927_030000_Eyewitness_News_at_11,2833,992.6,7.4,https://archive.org/details/KYW_20160927_030000_Eyewitness_News_at_11#start/992.6/end/1000,"THEM IN THE UNITED STATES. WE HAVE A SITUATION WHERE WE HAVE OUR INNER CITIES, AFRICAN-AMERICANS,"
KNTV_20160927_010000_NBC_News_Special_2016_Presidential_Debate_1,KYW_20160927_030000_Eyewitness_News_at_11,2951.4,141.2,6.7,https://archive.org/details/KYW_20160927_030000_Eyewitness_News_at_11#start/141.2/end/147.9,"IT REPEALED. IF YOU LOOK AT IT THROUGHOUT THE COUNTRY, THERE ARE MANY PLACES -- >> THE ARGUMENT IS IT'S A FORM OF RACIAL"
KNTV_20160927_010000_NBC_News_Special_2016_Presidential_Debate_1,KYW_20160927_030000_Eyewitness_News_at_11,3130.7,161.6,4.6,https://archive.org/details/KYW_20160927_030000_Eyewitness_News_at_11#start/161.6/end/166.2,"OFFENSES AND IT'S JUST A FACT THAT IF YOU'RE A YOUNG"
KNTV_20160927_010000_NBC_News_Special_2016_Presidential_Debate_1,KYW_20160927_030000_Eyewitness_News_at_11,3728.1,177.2,6.4,https://archive.org/details/KYW_20160927_030000_Eyewitness_News_at_11#start/177.2/end/183.6,"COME TO THAT CONCLUSION AND I THINK I DID A GREAT JOB AND A GREAT SERVICE NOT ONLY FOR THE COUNTRY,"
KNTV_20160927_010000_NBC_News_Special_2016_Presidential_Debate_1,KYW_20160927_030000_Eyewitness_News_at_11,3773.2,185.7,12.3,https://archive.org/details/KYW_20160927_030000_Eyewitness_News_at_11#start/185.7/end/198,"NOT AN AMERICAN CITIZEN. THERE WAS ABSOLUTELY NO EVIDENCE FOR IT, BUT HE PERSISTED. HE PERSISTED YEAR AFTER YEAR BECAUSE SOME OF HIS SUPPORTERS, PEOPLE"
KNTV_20160927_010000_NBC_News_Special_2016_Presidential_Debate_1,KYW_20160927_030000_Eyewitness_News_at_11,5632.4,865.2,26.1,https://archive.org/details/KYW_20160927_030000_Eyewitness_News_at_11#start/865.2/end/891.3,"THEY'RE NOT PAYING? ALL YOU HAVE TO DO IS SPEAK TO THEM. WAIT, YOU HAVE SO MANY DIFFERENT THINGS YOU HAVE TO BE ABLE TO DO AND I DON'T BELIEVE THAT HILLARY HAS THE STAMINA. >> LET'S LET HER RESPOND. >> WELL, AS SOON AS HE TRAVELS TO 112 COUNTRIES AND NEGOTIATES A PEACE DEAL, A CEASE-FIRE, A RELEASE OF DISSIDENTS, AN OPENING OF NEW OPPORTUNITIES IN"
KNTV_20160927_010000_NBC_News_Special_2016_Presidential_Debate_1,CNNW_20160927_110000_New_Day,680.2,123.6,3.1999999999999,https://archive.org/details/CNNW_20160927_110000_New_Day#start/123.6/end/126.8,"THE BIGGEST TAX CUTS"
KNTV_20160927_010000_NBC_News_Special_2016_Presidential_Debate_1,CNNW_20160927_110000_New_Day,831.3,110.6,2.2,https://archive.org/details/CNNW_20160927_110000_New_Day#start/110.6/end/112.8,"TO SECRETARY CLINTON,"
KNTV_20160927_010000_NBC_News_Special_2016_Presidential_Debate_1,CNNW_20160927_110000_New_Day,956,157.4,15,https://archive.org/details/CNNW_20160927_110000_New_Day#start/157.4/end/172.4,"PERFECT STORM. IN FACT, DONALD WAS ONE OF THE PEOPLE WHO ROOTED FOR THE HOUSING CRISIS. HE SAID BACK IN 2006, GEE, I HOPE IT DOES COLLAPSE BECAUSE THEN I CAN GO IN AND BUY SOME AND MAKE SOME MONEY. WELL, IT DID COLLAPSE. >> THAT'S CALLED"
KNTV_20160927_010000_NBC_News_Special_2016_Presidential_Debate_1,CNNW_20160927_110000_New_Day,1037.7,1543.8,13.7,https://archive.org/details/CNNW_20160927_110000_New_Day#start/1543.8/end/1557.5,"INVESTMENTS WHERE WE CAN GROW THE ECONOMY. TAKE CLEAN ENERGY. SOME COUNTRY IS GOING TO BE THE CLEAN ENERGY SUPERPOWER OF THE 21st CENTURY. DONALD THINKS THAT CLIMATE CHANGE IS A HOAXE PERPETRATED BY"
KNTV_20160927_010000_NBC_News_Special_2016_Presidential_Debate_1,CNNW_20160927_110000_New_Day,1156.5,143,4.4,https://archive.org/details/CNNW_20160927_110000_New_Day#start/143/end/147.4,"THEY'RE GONE. AND HILLARY, I JUST ASK YOU THIS, YOU'VE"
KNTV_20160927_010000_NBC_News_Special_2016_Presidential_Debate_1,CNNW_20160927_110000_New_Day,1283.3,126.4,6.9,https://archive.org/details/CNNW_20160927_110000_New_Day#start/126.4/end/133.3,"DEVASTATION WHERE MANUFACTURERS DOWN NA"
KNTV_20160927_010000_NBC_News_Special_2016_Presidential_Debate_1,CNNW_20160927_110000_New_Day,1549.9,17.8,4.2,https://archive.org/details/CNNW_20160927_110000_New_Day#start/17.8/end/22,"I DON'T THINK GENERAL DOUGLAS MacARTHUR WOULD LIKE THAT TOO MUCH. >> THE NEXT SEGMENT -- >> AT LEAST I HAVE A"
KNTV_20160927_010000_NBC_News_Special_2016_Presidential_Debate_1,CNNW_20160927_110000_New_Day,2010.9,178.9,5.3,https://archive.org/details/CNNW_20160927_110000_New_Day#start/178.9/end/184.2,"THIS COUNTRY THAT HAS TO BE TAKEN CARE OF. I WILL RELEASE MY TAX RETURNS AGAINST MY"
KNTV_20160927_010000_NBC_News_Special_2016_Presidential_Debate_1,CNNW_20160927_110000_New_Day,2107.8,187.2,6,https://archive.org/details/CNNW_20160927_110000_New_Day#start/187.2/end/193.2,"WALL STREET AND FOREIGN BANKS. OR MAYBE HE DOESN'T WANT THE AMERICAN PEOPLE, ALL OF YOU"
KNTV_20160927_010000_NBC_News_Special_2016_Presidential_Debate_1,CNNW_20160927_110000_New_Day,2110.8,3426,23.7,https://archive.org/details/CNNW_20160927_110000_New_Day#start/3426/end/3449.7,"OR MAYBE HE DOESN'T WANT THE AMERICAN PEOPLE, ALL OF YOU WATCHING TONIGHT, TO KNOW THAT HE'S PAID NOTHING IN FEDERAL TAXES BECAUSE THE ONLY YEARS THAT ANYBODY'S EVER SEEN WERE A COUPLE OF YEARS WHEN HE HAD TO TURN THEM OVER TO STATE AUTHORITIES WHEN HE WAS TRYING TO GET A CASINO LICENSE AND THEY SHOWED HE DIDN'T PAY ANY FEDERAL INCOME TAX. >> THAT MAKES ME SMART. >> IF HE'S PAID ZERO, THAT MEANS ZERO FOR"
